bangga banget pas labrak nature republic pamer geblek,1,1
burik wkwkg,1,1
orang munafik bahaya buusemoga allah lindung,0,0
tunggu buaya lobang,0,0
presiden publikasi asi games 2018,0,0
anies bincang salat jumat erdogan warganet gubernur presiden,0,0
nyata resmi ketua front bela islam adek armando 1 adek armando orang akademisi laku jahat amp kotor benci amp fitnah noda agama amp ulama,1,0
bikin kayak minder pot pipi tumpah berengsek tirus gue sodor pipi gue sih biar tau definisi tembem kamus gambar ide puji hati,1,1
hadeeeh sembunyi bangkai cium bau ku ah,0,0
asyik nih pesawat presiden,0,0
jurus orang gila kebut lalatajian tatar bayujurus kunyuk lempar buahdewa tidurpukulan matahariajian rogoh sukmohanya siul kapak naga api 212 kalah dewi siluman bukit tungguln uniform resource locator,0,0
mentari pagi agama kristen pagi umat nasrani lagu lagu nasrani hadir,0,0
habis gelap terbit terang road to,1,0
bacot gaya otak timpang,1,1
aseeqqqq oppa oppa sipit,0,0
kasar sihnnkakean cocot ki,1,1
golong 1a halina kawin robi rekan frustasi golong 2a beli mangga campur sirup barium radium gue lupa wkwk golong 3a intelngolongan 4a ceri sih gendut puber,0,0
cina usir zaman belanda tukang penghianat,1,0
geblek auto nyanyi,0,1
rakyat dukung komisi berantas korupsi ri usut tuntas anies sandianggota dpramien rais kuasa elite politik libat korupsi,1,0
untung bantai warga ahmadiyah jokowi salah,1,0
agama kedok tipu kali polisi hasil tangkap pasang suami istri nilai tipu 5000 jemaah bawa kabur uang rupiah 100 miliar sosok,0,0
ustad pasar senin om hitung hitung cerah jual bawang putih cina halal,0,0
bajing rampok negara,1,1
cinta dukung presiden permadani ali sera cebong kampreter cantik,1,1
mbah saleh ketua dewan wakil rakyat budaya identik peunjukan seni jakaa ketua dewan wakil rakyat bambang soesatyo bambang soesatyo perintah menjadikana,0,0
bicara kayak orang berak,1,1
aikelnya isi an,1,0
aher istri om om indonesia lawyers club kemarin ganti presiden mardani istri ketua partai adil sejahtera presiden partai adil sejahtera istri si,0,0
nih partai demokrasi indonesia juang nasional demokrat bicara ganyang partai komunis indonesia memble,1,0
ajar slow living organik and vegan gaya hidup urban farming life manajemen prancis bikin sadar indonesia budaya miripmirip utama budaya terima balance syukur mas,0,0
universitas titip mata mata rezim awas giat mahasiswaaneh rezim,0,0
bantah photo bukti komunikasi sambung 2 pimpin,0,0
teriak anti asing asing fadli zon beeman donald trump fadli zon mental munafik,1,1
1 mata gue sipit kayak orang korea wqwqn2 keluargan3 my voicen4 badan gue bilang idealvn5 armynand i love my everything my life my bts,0,0
wkwk rejim rakyat,0,0
bagus phao rumah pakai bahasa indonesia bagus bagus pondok indah bintaro jaya kota wisata pakai bahas asing residen desa hill hhhhh hancur harga bahasa,0,0
anies sandi haha ter bongkar wajah asli saracen,1,0
haha main media sosial dungudasar kecebong,1,1
nih baca tai spam kado uniform resource locator,1,1
mundur sanggup makmur rakyat,1,0
selamat natal hehedasar sih admin bolot,1,1
innalillahi ilaihi rojiun keluarga nahdlatul ulama duka cita wafat kiai kholilurrahman ra lilur cicit syaikhona kholil bangkal moga allah rahmat ra lilur sisi aamind,0,0
aneh orang orang geblek habib rizieq shihab berani komentar anggap guru berani gendeng deh habib rizieq dukung hina guru dasar fira,1,1
memek gatal ngentot pakai kontol keker,0,1
kuat hadap bacot sumpah kuat,0,1
ungsi asing ungsi asing dodol,1,1
mending bubar bikin lembaga anti korupsi paradigma benarbenar bebas,1,0
13 pakat karakteristik pribadi cermat kondisi faktual internal sbypd susilo bambang yudhoyono taipan ha limpah kayak,1,0
al fatihah,0,0
butuh memek hubung rupiah haneul,0,1
najis mahal mahal sih,0,1
for me kucing cacat nih is the precious gift event sempurna but they r cute in their own way comel kucing,0,0
mantap mahmud kontol gue muncrat kapok tante bo uniform resource locator,0,1
kunyuk ditindakpemerintah jokowi lemah,1,1
sherlock holmes idiot geraham bel bodoh detektif temu telepon orang temu jenius,0,1
lelah amin doa lelah cacat ibadah moga dunia surga,0,0
tuan guru bajang presiden nusantara for indonesia for rakyat,0,0
istilah kopar lapor partai komunis indonesia asing asing pria noprikarena sejati negara republik indonesia,0,0
menteri suhao homo,1,1
malu presiden korup era soehao susilo bambang yudhoyono,1,0
tunggu hoshi sipit tunggu woozi mingyu,0,0
angkara komunis mustahil mahathir pm nih,0,0
jokowi tunggu 2019 2017 lengser konstitusi sajahehe,1,0
tuan guru bajang dukung jokowi 2 periode bani micin kaum bumi datar kejang kejang nih,1,1
prabowo mimpi ri 1 mustahil mimpi siang bolong mas piyu sakit mimpi,1,0
halo selamat siang tinggal putar minyak produk jlkunti street minyak,0,0
ubah total anti asing asing cinta asing asing,0,0
harga saudara pilih orang ateis tipe orang hak lurus mata orang berbedabe,0,0
jaman susilo bambang yudhoyono korupsi besarbesaran proyek mangkrak penak mbah,1,0
fokus kang menang pasang amp gubernur jabar abai,0,0
ahok paham pb bahan serang p jokowi kelompok bani togel 212 kang surat pemberitahuan remisi napi 1 teroris koruptor narkoba kang p ahok bebas murni,1,0
presiden kampung sambut riah tukul kampung sambut riah gede sambut rakyat bangga rakyat indah budaya gede,1,0
komisi berantas korupsi mimpi berantas korupsi orang sangka koruptor,1,0
guru desa sei kanan deklarasi anti hoaks amp pilih kepala daerah 2018 damai,0,0
kaya indonesia serah asing,0,0
prank level tai anjing uniform resource locator,0,1
rohingya muslim rescued at sea off sumatra indonesia ekspat,0,0
bangkai mas,0,0
pasang calon baguskrn 2 pasang calon cenderung konflik akar rumput trbukattp sadar diribhw pt 20 susilo bambang yudhoyono brkuasajd pojok koalisi dukung jkowibrai mata kakak,0,0
jual badan usaha milik negara migas energi beli freepo bang jual cebong cebong indonesia pintar pintar lucu lucu,1,1
gaji 3 juta prabowo presiden 6 juta pikir maju kayak sekolah kerja giat salah jokowi kayak ustad provokator,1,0
adanneh karcis parkir pegangnah tai serius lunntiap mal,0,1
larang ajar komunisme sisi perintah buka pintu masuk wisatawan komunis besarbesaran negeri,1,0
tarik gacha dantori tadikampretkandaiyaku habis,0,1
ronaldo pardede siswa kelas 5 sekolah dasar katolik karya yosef,0,0
cewek jago ngentot berondong cakap bikin tante nafsu cari berondong uniform resource locator,0,1
aceh usir gubernur kalimantan manado usir anggota dewan jakaa usir arab usir cina asyik nih tren usirusiran,1,0
lgbt musnah golong terlibatnrasuah salah kuasa musnah bangsa negara tahap bahaya dosa harap sibuk rang lbgt tutup mata mungkar nsamasama men,0,0
agama islam agama samawi bahasa arab ainya langit agama samawi bangun dasar wahyu tuhan malaikat jibril nabi rasul tulis kitab suci kitab suci alquran,0,0
rapat koordinasi kembang bandara plt gubernur jawa hadir presiden ri purbalingga,0,0
teaip presiden,0,0
cepat hebat lambat cacat,0,0
maaf kang lari negeri,0,0
yesus kristus suka bikin orang percaya hidup miskin derita hem berengsek tuhan,1,1
calon wakil presiden gempar bani oposan nama juragan ganti cebongkampret cerita,1,1
harap peamina saing usaha minyak dunia amp negeri beahan direktur utama tanda nasib bikinteken proyek kilang minyak realisasi cepat 35th nasehat duduk manis bikin,0,0
raih sebaliknyangue matre bayar dianpadahal faktanyandasar banci potong itunyann uniform resource locator,1,1
nih jilboobs pintar sepong kontol yaakknhijab sange emut anun,0,1
antek asing impo cina usung partai adil sejahtera amp gera indonesia raya nurut paai gerakanndak munaspil ketua,0,0
indonesia 1 vietnam 0,0,0
mampus sangkut om om,1,1
jawa gereja kristen jawa gereja kristen jawa ajar bahasa jawa campur ajar kejawen budaya lokal rugi rugi,0,0
nyali gubernur indonesia uji kembalibeliau berani lawan konglomerat konglomerat hitam gubernur berani rakyat daya,1,0
ganti jokowi prabowo,1,0
kristen nusantara iring budaya agama jalan budaya lokal lestari,0,0
masya allah dungu makan tahi jokowi era negeri rusuh rupiah pei hutang ln pei aset bangsa jual pei bangun tol ambruk,1,1
aksi turun jokowi biar selamat indonesia malu calon presiden,1,0
bentar ulang unn kirim rombong topeng monyet raya,0,0
kerja seks komersial campur lepas kerudung kerja seks komersial baca twit fahri benci jokowi balas jokowi presiden maki maki orang fahri twit fahri penuh,1,1
jotef hitam berengsek nnwkwk 0,0,1
dasar gila,1,1
uang negara ustad kayak sembako incumbent uang negara rezim bangsat,1,1
tradisi katolik raya ekaristi misa nuansa daerah nama misa enkulturasi imlek misa inkulturasi tionghoa,0,0
lucu kak woozi sih tuyul lucu tuyul,0,0
masuk kerja mencret capai kemarin,0,0
wkwk tag polisi republik indonesia anjing tolol banget sumpah,1,1
,0,0
anak muda meluapluap semangat bebas paham konservatif ranah burhanuddin al helmy jaya presiden pas tewas ustaz abbas alias,0,0
maksud domba idiot akun,1,1
ustad bicara bahasa mbokne jancuk mata picek jamin 100 ustad abalabal,1,1
nyata ketapang kalimantan barat masuk wilayah kerja polisi cina nini bahaya aman nasional ri tau sih rezim nnmakin rezim kuasa cina tanam pengaruh buruk disininn,1,0
lupa twitter instagram foto komen ih cantik cantik cantik ih anjing cantik tau ih babi cantik pokok,0,1
grace uap lebar mata sipit sipit hem apaapa kak pulang kak antuk,0,0
cebong dongokkkk,1,1
alah kubu muslim orang tuhan hitung nomer takut kena serang jantung kayak p,1,0
cebong cina komunis cinta sih jamban,1,1
ganyang partai komunis indonesia waspada bahaya laten,1,0
ainya banci randa,0,1
anies doa amanah istikamah jalan tugas gubernur daerah khusus ibukota jakaa,0,0
ganti presiden 2019 via uniform resource locator,0,0
ejek bacot ngentot nikah ajak ngewe,1,1
pantat ih,0,1
peanyaan beli tol otomatis tarik duit tol beli tol asing asing berai asing asing pakai kuno,0,0
gila kids jaman jigeum sungguh bahagia gue umur 10 main taplak gunung,0,0
sandi bilangjgn bully pakai asing asing butuh negara masuk cina,0,0
masyaallah wkwk antek antek muncul wehhh lini ku,0,0
pergi mampus benda kinda suasana hati,0,1
gede pipi mata sipit hem,0,0
usir bakar lilin aksi bineka aksi teroris cina bukti mata sipit pegang lilin,1,0
produk gagal beli cundang pulanneh om sedia kaos tim negara negara onta payah bikin tau selera pasar,1,1
lihat agama mayoritas tindas aniaya bi indonesia,1,0
suka nete km,0,1
buku lawasgt ilmu agama muhammad hatta 1983 36 halaman harga 125000 minat,0,0
baju nikah pamer paviliun baju melambang waris tradisi budaya kasih,0,0
presiden ri megawati soekarno putri unjung pamer arsip konferensi asia afrika kakak 63 kakak langsung selasarabu 17184 widya graha jakaa selatan megawati delegasi muda konferensi,0,0
cinta budaya lokal berai kampung cinta budaya barat berai barat barat lagu timur barat selatan utara lagu wali,0,0
bubar dewan wakil rakyat asli negara jalan,1,0
orang kawal hidup nak nak bodoh nak pandai,0,0
bacot,1,1
punuk onta sombong sok tau nih,1,1
diam setan,1,1
kwsp sumber rm11456 miliar,0,0
mesum warga suruh haha kocok emut kontol puret tegang,0,1
cape gue kayak bego teman teman gue diskusi uji,0,1
barat gereja kristen masyarakat trauma ragu agama,0,0
monyet songong uniform resource locator,1,1
gila sinar light laser rajam hidup orang cacat kulit community dukun tata endah sign indonesia raya rendah maabat hidup orang penuh kenistaaan hidup orang orang media,0,0
ambil referensi status fbtwitterigdllnditanyain no kontak alas lupanbangsaa tolol emangmakanya maju maju,1,1
mending nete bu joy,0,1
habis minum kencing onta,0,1
tuju percaya gosip,0,0
mata picek sih babang,1,1
sekolah jumat jumat foto kelas sekolah buku gembel foto kelas tema bebas,0,1
nyata sudut pemerintahsungguh naif amp munafik andaanda hidup manusia tau terima kasih amp balas budiitulah tolol,1,1
muslim jabat negara wajib dampak buruk aji salat,1,0
puisi kampung bodoh ilmu dunia bodoh ilmu agama innalillahi,1,1
dunia muslim bantai umat,1,0
he sinting uniform resource locator,1,1
ku muka pas umur 16 literally kentang mulus bersih cacat surat pemberitahuan bilang cant relate skincare simpel fw banget,0,0
sipit sipit bantat kayak seungmin,1,1
gue dengar bocah khayal mimpi basah komentar ulah anak orang kayak ayo bocah presiden hina,1,0
kang fakta inipaai dukung sih nista agama benci rakyattermasuk rakyat jabar uniform resource locator,1,0
tertawa anjing wkwk serius gue pikir maki salah sih taeyong mulu canda doang,0,1
prestasi ahok mafia koruptor nista agama hasil tenggelam jakarta congor cebong,1,1
budaya lepas kodok ikan burung budaya cina kuno jujur rakyat indonesia,1,0
gubernur daerah khusus ibukota jakaa anies baswedan beemu presiden turki resep tayib erdogan tunai salat jumat mesjid sultan ayub istanbul turki jumat,0,0
cebong main kolam pakmakanya tauudah tanggepinntar cebong nongol dasar kolam butek,1,1
monyet komunis tolol,1,1
lupa malam jumat habis pencar tuyul,0,0
maafdukunnya sibuk bakar menyan bani kampret,1,1
ayo lengser sih joko,1,0
2 suka si cepat ekspres 1mendapatkn sms notifikasipemberitahuan noresi lacak paketbarang kirim 2barangpaket kirim cepat aman cacat,0,0
cuap cuap hebat salah berai promosi susilo bambang yudhoyono sampah will see,1,0
kucing rumah kakak kerja makan tidur main tai pipisnkek rang kayak wkwk,0,0
neo komunis antek cina sebentar musnah negeri,1,0
makase fren fren ku gue duduk tai kucing kunci motor teylap binasa,0,0
orang orang budek tuli pekak tolol,1,1
sembako gembargembor nama presiden utang diam diam nama rakyat,1,0
lihat lokasi muhammad bantai 800 yahudi 1400 lukman,1,0
gubernur presiden,0,0
klik,0,0
harap cek sehat benci deh hidup buruk jumpa kelompok terbang,0,0
astagfirullah allah hamba setan kutuk,0,0
budek,1,1
benarbenar diktaktor otoriter presiden,1,0
mampus a kayak gue wkwk,1,1
nete abang 3 ggg,0,1
lurus depresi suicidenteman tuhannnbodo gue cape,0,1
menteri sontoloyo,1,1
salah orang baca 3 ayat dalamnshalat tiganonta hamil gemuk muslim,0,0
ayo zul kritik,0,0
kurikulum cinta indonesia hapus ganti kurikulum cinta cina,1,0
hehe dungu otak km susah km anak ingus tumbuh mengei nete dasar kadal kebun,1,1
sadar bom takjil malang,0,0
gue ngei pola pikir orang tua suruh anak teman autis benerbener manusia sih jahat banget pei pintar,0,0
turun partai komunis indonesia marah,0,0
cacat mbappe,0,1
presiden gelar rapat kabinet batas agenda bahas cepat laksana usaha,0,0
kafir musuh munafik bunuh,1,1
rejim muncul istilah mesjid radikal syiah komunis liberal,0,0
selamat siang ngentot yuk jumat uniform resource locator,0,1
polisi daerah jawa aman pilih kepala daerah 2018,0,0
syarat calon wakil presiden jokowi 2019 aju ppp salah jaga narasi bangsa indonesia indonesia pimpin gabung narasi nasionalisagamis agamisnasionalis,0,0
menteri hukum hak asasi manusia kena md3 hak imunitas debat undang undang pilih kepala daerah ketok palu presiden atur perintah ganti undang undang md3 presiden atur perintah ganti undang undang tanda tangan,0,0
panglima tentara nasional indonesia pemuda pimpin bangsa,0,0
sitip,0,0
dewan wakil rakyat butuh dukung kayak nih hak nyata lengser jokowi daulat tangan rakyat serah rakyat,1,0
gan kisah bunga hangat course gue haha gue pikir natural killer detail gera member gue tahap gila tahap natural killer tepi kain orang but im sweet stalker cantik and,0,0
selingkuh risih pandai simpan bangkai cium juganwaktulah bukti,0,0
memek eh mewek,0,1
mampus,1,1
jokowi antek zionis komunis paranoid islam uniform resource locator,1,0
gawat ketimbang perintah kecele berkalikali kerja usaha asing,0,0
memek lonte sodok kontol gede,0,1
12 presiden harap skema kerja laku pembangunanpembangunan a a a,0,0
bukbernnekspetasi gue flasback bahas ngegoblokin laku pas sekolah biar have funnnrealitanya bahas kerja sombong anggap kerja kontol bangsat nndasar aditfajarilmah,1,1
udik gay,1,1
wkwk bangkai ketuk jendela,0,1
sih dakwa nista agama alias sih ahok babi jamban morfin uang rakyat jakaa,1,1
suka iri orangorang rahasia kulit mulus air wudhu kristen,0,0
orang indonesia jabat tingggi negara republik indonesia salam bahasa orang arab bahasa indonesia rendah,1,0
pakai jurus tenaga kerja asing kaliyg lokal habis pecat pelan pelan,1,0
heran setan iblis kabur takut dengar azan makhluk allah anteng si,0,1
ekor monyet kebun binatang tianjin cina viral milik wajah pei manusia monyet usia 18 jenis capuchin amerika uniform resource locator,0,0
dukung aye diam diam kagum duet jokowi puan capresampcawapres sumpah,1,0
pb wibowo gay,1,1
kali sih bolot,0,1
ah pekan tai,0,1
teman budak antek,0,1
loh warganet nilai jonru rugi rakyat jokowi uniform resource locator,1,0
islam nusantara produk jil pasar gencar antek jilnnsementara jil anti arab pro asing nnkata almarhum kh hasyim muzadi jil kafir kafirnnjadi umat islam,1,1
sayang gendut ulang gila sih tua umur puluh asyik cepat ketemu salihah pei harap moga tinggal,0,0
jokowi tuduh partai komunis indonesia prabowo tuduh otoriter halo mas agus harimurti yudhoyono senyum senyum kumpul kuat politik haha,1,0
bunda pro banget goyang kontol suaminyaprivate bun bosan lihat video kasih biar vera lihat trusnnhtt,0,1
abang bahasa asing basa asing no no basa inggris dek basa asing,0,0
era susilo bambang yudhoyono alat libas lawan komplot,1,0
kang lengser jokowi kerja pikir infrastruktur pikir rakyat nyaman ekonomi stabil,1,0
berengsek banget kirim foto setan,1,1
andre onta mate hajar,1,1
enak nih entot kontol uniform resource locator,0,1
weh kunyuk,0,1
gila nih panas nutrisari jeruk amerika idiot keringetan,0,1
tg rupiah nitrogliserin sori orang orang sadar etik banci naksirdicemburuin hdh,0,1
jablay cari perhati tulang tulang cuihin,1,1
ustaz subki albughury si sosi dukung pilih kepala daerah damai kabupaten sinjai hoaks benci isu sarakalau,0,0
ayo agama mu kristen protestan ateis buddha hindu malu agama,1,0
basah memek entot,0,1
cebong bani bumi datar,1,1
gue culun orang bekal mimpi minat amp ketrampilan,0,0
cewek nih tolol deh gara gara cinta rela hormat,0,1
adil negeri ajang benci sara sih dakwa iman hakim iman ringan hukum beda agama hukum berat berat sogok pakai duit adil indonesia,1,1
i added a video to a playlist,0,0
cebong ahli bully ahli bully gerombol kampret panik temu sosok pas ganti jokowinitu ainya jokowi wajib 2 periode,1,1
memek nikmat ku suka,0,1
kasihan terbatabata bicara lupa bawa teks mmperhatikannyad hormat sukses anies,0,0
wagirin arman apresiasi usul pilih kepala daerah pilih dewan wakil rakyat daerah,0,0
berengsek gue tobatntiba video bokep munculnterkutuk boy nge in,1,1
he su asusehat,1,1
wkwk untung gue goblok alias pintar orok v,0,0
paai tolol indonesia pimpin kafir catet,1,1
dungu dukung prabowo cong serang hadehhh dasar banci,1,1
prabowo musuh partai komunis indonesia antekanteknya uniform resource locator,1,0
banding n4dnn4d talenta bgtnlu panjat sosial banget sih najis,1,1
ganyang partai komunis indonesia hapus lambang partai komunis indonesia film intimidasi komunis antek partai komunis indonesia pei hantu,1,0
kampret nih sih jimmyloe duit tiru ulama ulama goblok goblokin goblok bin bahlul copot atribut atribut palsu ganti seragam cebongloe mati sengsara azab allah amin lihat,1,1
gue heran warga daerah khusus ibukota pilih kepala daerah ribut mayat gubernur ribut mayat salah allah takdir tolol isi ulang,1,1
mang kartu tanda duduk tulis cebong mas butuh perhati kasih sayang sih,0,0
duga sedia kerja seks komersial warung kopi kabupaten tangerang tutup uniform resource locator uniform resource locator,0,0
harap maklum isu toku idiot,0,1
2 jalan kali presiden damping kepala staf presiden koordinator staf khusus presiden teten masduki staf khusus presiden diaz hendro priyono komandan pasu aman presiden mayor jenderal tentara nasional indonesia mar suhaono,0,0
eyyy kepala ngewe,0,1
alam urus surat administrasi nikah n1 n2 n4 pasang beda agama kristen katolik,0,0
setan nama cinta,0,1
coba ahok bicara bani kampret murkannnnnnn,1,1
malas gerak mantap banget anjir bintang tamu naif ari lasso padi jaz ran fouwnty hivi danilla,0,1
warga badui selesai tradisi seba pendopo perintah kabupaten lebak beemu gubernur banten wahidin halim sabtu 214 generasi pesona indonesia,0,0
dasar goblok tololnkri pimpin manusia turun ontaharus cari pimpin warga negara indonesia asli pintar berbobotbukan turun onta otak isis,1,1
guru sekolah dasar desa plumbon porong deklarasi anti hoaks benci isu sarah dukung pilih kepala daerah damai,0,0
sumpah anjir kesal banget gue allah,0,1
presiden sowan kantor majelis ulama indonesia jawa barat presiden ulama insya allah indonesia berkah,0,0
sombong situ kampret cebong rendah hati rajin aji,1,1
kegodanpengen bantu nnnbantuin pegang ujung kaosmunnutupin titit tai,0,1
dasar bini suruh beli santan dok lepak kedai mamakbrengsek haiz amin mandor nih uniform resource locator,1,1
suara orok kayak kambing bandot coba pakai gergaji mesin malam malam suara masjid bilang gue budek eh pas kamar nyata haha,0,1
bangsa cundang cukong antek asing,1,1
borang televisi mbah uti yoyakarta,0,0
perut buncit tidurcebong ngei,1,1
contoh sungkan laku hitung ambil sihnn chiyachan diamdiam tangan remet bokong sih helai pasi,0,1
djarot gubernur sisa jabat periode 20122017,0,0
ah asa bukti muslim rohingya usir myanmar perkosa gadis buddha tanda bejat,1,1
proyek tambang emas perak asai asing,0,0
celeng celeng,1,1
bunuh karakter mayor jenderal kivlan zein rezim antek komunis wakil foto,1,0
bilang sih kunyuk omong suruh cari kerja calo politik agama tameng nte lihat karma,1,1
tuduh syiah komunis yahudi antek cina konsisten warganet misionaris,1,0
8 henti reklamasi tutup alexis janji lepas saham aniessandi kampanye p,0,0
iri tolol,1,1
biar gatot mundur pilih presiden 2019 lawan jokowi,1,0
kereta ac ekonomi tuju serpong berangkat harap catat pintu,0,0
melempem maaf tenggorok kering,0,0
hak lawan batil rezim mukidi hak menang insyaallah,0,0
calon presiden calon wakil presiden ri 1 nih pintar pro orang otoriter,0,0
jokowi diktator,1,0
nihmasih ngelessoal tenaga kerja asing cina 1000 orang masuk kendaripak deh hebatpengguran indonesia bebas tenaga kerja asing cina biar an,1,0
waspada bajak agama dosa agama,0,0
desadesa indonesia ajar positif ku rindu,0,0
cebonger nih junjung tembak tiarapapa habitat bisu jemaah,1,1
om tangkap dosen usu j tangkapklo om berai sontoloyon,1,1
koar koar anti asengimponya tiongkoknknpa impo india malaysia,0,0
mending makan murah buangbuang duit tainnatau sih a beli barang murah sih b komen ih beli situ sih murah bahan bagusnnlalu sih b langsung sakit hati sih a,0,1
alamak jumpa gambar salah orang pimpin juang melayu islam umno bn nasib clubbing kat tangan gambar pimpin bn nak,0,0
janji prabowo janji janji realisasi 1 periode menang pilih presiden janji gombal undang undang md3 berangus bebas lihat cermin orang beli cer,1,0
cina nih kereta perempuan,0,0
serius mbah meng main film kafir cerita tarik sesuai hati nurani,0,0
pimpin dungu rakyat berkah,1,1
kemarin kayak kutip twit kristen,0,0
1 bajing,1,1
mayoritas warga jokowi presiden,0,0
lemah 1 kerja jeblok 2 karakter bobrok 3 elektabilitas anjlok 4 citra mentok 5 dukung goblok 6 kalap emis tiongkok 7 macan kodok prof jeffrey musim dingin jokowi presiden lemah sejarah in,1,1
tuyul majikan hehe,0,1
percaya mulut orang inibila xg kenal orang info biar sumbat mulut pakai petas biar modar anjing bohong,1,1
gera komunis dampak jalan politik dunia masuk indonesia,0,0
awas puisi sukmawati pakai senjata politik udik,1,1
mampus rupiah kompetisi jembatan indonesia ngardus 2 gue perhati,0,1
ambil course graphic design gaya pergi class budak fashionnnyaa setan budek nak pakai baju tidur pergi class hanatnye designer appearance noted thatnnmaju anjing,1,1
anjir nick pas bona kimcil gue make unhi nick unhi universitas hindu indonesia,0,0
mampus aib bongkar,1,1
temu orang ustaz babi diharamkannlah warganet pintar ngatangatain bodoh hidup manfaat aji,0,0
gara gara 23 dramafilm korea tonton bersetting 19871988 penasaran korsel kenang sejarah kali olimpiade seoul korsel anti anti komunis gesek gesek tetangga,0,0
bukti valid bahaya virus idiot minum salah admin,0,1
menteri negeri indonesia janji hancur kuat antichina jokowi anti pribumi turun jokowi tiru turki,1,0
tri bom,0,0
bicara sih suruh sih cabul pulang banci,1,1
hulk marah,1,0
dasar ayat al alquran allah hilang ilmu kelip mata hilang ilmu ranah hilang ulama muka bumi lantik ketua manusia jahil,0,0
cipta tujuh langit berlapislapis lihat imbang cipta tuhan maha asih lihat lihat cacat,0,0
buta hati buta mata lihat tenaga kerja asing ilegal liar negeri dungu piara,1,1
nyata kotor ayam najis nnnnbismillah alhamdulillah was sholatu wassalam rasulullah wabah,0,0
beda alas kuat bubar masyumi dukung ronta prripermesta tolak pecat anggota partai komunis indonesia bubar peristiwa gera 30 september,0,0
hadir acara paai koalisi dukung pasang gubernur jawa timur nomor urut 1,0,0
oi ngantukkk banget bangkai suka masuk pagi,0,1
gerombol cebong umpet kayak sembur air,1,1
wajar sih budek,1,1
main hati ngacakngacak asa resan goblok kotor lt3,0,1
pandai ilmu agama cerdas ilmu dunia perempuan ajar 14,0,0
presiden pai je layak pm manusia pai nih harap pai nak pm,0,0
kafir obral sajajuga tutup tutupimmg jahat kejahatanbukan salah agamanyasukunyawarna kulitnyaprofesinyapribadi orang,0,0
edan didinya euy madep top,0,1
mampus gembel kalah debat anak lihat kaum cetek tau ainya kaum pikir dangkal sifat paksa argumen terima bodoh,1,1
attend kelas,0,1
masuk akal logis perintah biar acau proyek strategis elektonik kartu tanda duduk pengacauanpenggagalan cetak blanko elektonik kartu tanda duduk biar presiden susilo bambang yudhoyono buka,0,0
pakai kacamata bang sipit,0,0
sih ketek onta,1,1
60 sahabat nabi pergi rantau embara timur cari bani jawi situ bani jawi terima islam peperangan dukung islam wajib,0,0
tenaga kerja indonesia formal jutawan om admin nnrekan2 kerja sektor oil amp gas timur kuwait uni emirat arab amp qatar ratarata hasil bersih 5000 usd level operator level engineer,0,0
kerja sisternetkemendes bangun daerah tinggal transmigrasi dorong internet media sosial tingkat ekonomi desa,0,0
