haha nndan sekolah katolik agam anak kebun usaha later suku agama terima sekolah katolik alami amp ubah,0,0
subhanallah bahagia pimpin pei beliau,0,0
syukur allah subhanahu wa taala presiden giat kerja hadap kerja lurus ikhlas mata indonesia maju ramping energi p,0,0
mudah lihat orang condong arah sosial media peama akun perempuan gambar curi google gambar anonymous manusia kampret akun embelembel nama pahlawan kaum muslim cyber army,0,1
calon wakil presiden jokowi 7 orang tinggal presiden terbit dekrit paai usung jatah 1 calon wakil presiden jokowi sih atur perintah ganti undang undang terbit urgensi,0,0
malas duduk xleh orang kg budaya kg duduk xleh budaya hebat seram,0,0
entot dicrotin kontol uh uniform resource locator,0,1
pei kualat bobby mata gue sipit,0,0
franky presiden,0,0
sekolah pantesnmulutnya jaga kotor kayansampah,1,1
anjing jahanam berisik cocot,1,1
tekan jabat siasat lari lingkar politik antek milik modal islam progresif sesuai mukadimah undang undang dasar amal qs al hujurat,0,0
tomohon rupa pusat ajar agama kristen katolik khusus doa meditasi bukit kasih buah suci indah tenang nn,0,0
anies congor gede realisasi janji korupsi dosen bangsat,1,1
kesal kacrut televisi republik indonesia,1,1
suasana hati kerja ubah nih banci,1,1
kemarin kamis jumat singkat,0,0
pimpin cerocos nderomos jancuk deh,1,1
islam ideologi negara emban wajib sebar dakwah amp jihad pei as sebar demokrasi amp ussr sebar komunis karang jalan damai kadang perang syariat hukum syriyah amp kharajiyah,0,0
aduhternyata salah paham yadlm islam kafir beda 3 kafir harbi muahid kafir dzimmi,0,0
bahas tangkap ikan potasracun sampah plastik bahas tugas tentara nasional indonesia al,0,0
anjir,0,1
wujud katolik terpusatterstrukturteroganisasi pusat vatikan nu mengambilmerebut peran pei vatikan mudah,0,0
bilang orang hina agama kena hukum pidana orang maksud hina agama mayoritas singgung langsung hujat kena hukum,0,0
kacung terima perintahntidak terima kritik moga pimpin simbol kacungnkacung dikacungkacung terimankarena kacung tunas subur semerbak harum bunga bangkai,1,1
rindu suhao kroni kroni kayak rezim suhao jual bangsa,0,0
rahasia bong nkoruptornrampoknpelaku maksiatnpelaku bisnis maksiatnkaum lgbtnpenjilatndukun sesatndukun cabulnbla bla blantergabung bani cebong,1,1
mata buta lihat alam maya hati buta terima cahaya alam,0,0
cebong pindah on masuk kemako brigade mobil,1,1
serius ngewe sumpah,0,1
teroris buddha perintah kerah cyber army bikin hoaks amp retas akunakun prorohingya,1,0
kamar guru musholannnah kristen doa aula kristen nnaku teman kristen sih a sih a guru ambil cas laptopnyanndan,0,0
partai adil sejahtera paai lacur beyek germonnapakah partai adil sejahtera sadar susilo bambang yudhoyono otak kriminalisasi lhi politik islam khianat prabowohatta langgar pilih presiden 2014 hancur citra islam 20102018 nnpks susup antek be,1,1
dear driver tukar orang anter gue gue sih pintar dongok puter puter cari rumah gue pakai driver ganti dongok buang gue banget tunggu tai,1,1
maki cebong kaum codotplaying korban much,1,1
gue baca setan wkwk,0,1
orang islami bangun narasi tuju beda liberal sekuler munafik antek asing,0,0
betah kemarin desak majelis musyawarat rakyat sidang istimewa turun jokowi,1,0
mata gue sipit,0,0
gue normal member autis,0,1
najis banget sih bully adik atip,1,1
buaya gede gede,0,0
teriak bubar partai komunis indonesia orang pulsa listrik rumah habis kutuk orang ketidaktahuannya,1,0
tren konsumsi video beumbuh data,0,0
lukman hakim saifuddin substansial percaya agama,0,0
bajing orang kayak,1,1
allah mohon cepat ganti presiden biar indonesia selamat,0,0
jawa pos paul pogba selebrasi gol dengar tiru suara monyet uniform resource locator,0,0
dukung prabowo surat pemberitahuan arb sda orangorang bejat tabiat kasar masuk orang gtgt moga laknat allah,1,1
tentara nasional indonesia nafsu banget perintah doktrin karya dukung soekarno bubar parlemen dekrit,1,0
bahas ekonomi moral meni deh gue pakai akun tulis nama kayak antek asing gara gara asing kayak congor negara gue hina kayak tega,1,1
banget sih alucard,1,1
soehao dalang bencong hehe,0,1
bubar komisi berantas korupsi kuat lembaga negara sistem politik,1,0
nayeon 9 member kali suka ngepost instagram story suka bilang lesbi budak cinta banget kali,0,0
tubuh kurus muda orang milik punggung lihat tegap lebar mata sipit tanda kelopak garis wajah lihat gambar watak galaknn cont,0,0
pakcoy ih pacar kuuu,1,1
indosiar elang mahkota teknologi grup gembel siar bola,1,1
tampil serasa suci dunia laku kayak setan empati keluarga korban bom kemarin,1,1
cebong eh berudu olah terfait accomplianies calon presiden gubernur hidup tenang nikmat banget gue main cebong,1,1
tau pasu nasi bungkusyg kasihan daerah khusus ibukota skrgbuat daerah khusus ibukota harap bersabarini coba wkwk,0,0
aduh lebay nyanank didik soehao bob hasan menteri kabinet bangun jabat 3 16 maret 1998 21 mei 1998 bob hasan aka muhammad h,0,0
manusia monyet mamalia buta warna,0,0
betapa biadab teroris buddha myanmar uniform resource locator,1,1
rupiah haneul suka sepong kontolyang on retweet,0,1
baca onta nnmoga adik bayi cowok nan modusin haha,0,0
mampus tembak banget silvy urus dapur program suka serang,1,1
ngentot aris sexynurl,0,1
gue anjing penasaran bicara maju garuda kuping budek,1,1
bro kitab suci fiksi berai agama wahyu nyata surat pemberitahuan mutlak harfiah filosofis langgar umat agama konstitusi norma agama nista agama kotor,1,1
sontoloyo sok ipar allah subhanahu wa taala,1,1
akibat putus cinta sahabat entot lubang rapat bool memek,0,1
deklarasi pilih kepala daerah 2018 aman anti hoaks paguyuban budidaya lele jabon,0,0
ahok lantik gubernur anis anis gubernur,1,0
780 agama buddha kokoh adab masyarakat bangun candi luas candi sewu prambanan npd anut agama hindu utara bangun candi kalah,0,0
keras lawan keras pei kung fu kadang pakai tai chi lembut kuat lawan,0,0
mulut buaya,0,0
hoaks pintar dongudah dungu begokasian dungu tololx,1,1
urus duit hitung bisnis perintah indonesia untung tepuk tangan buntung risiko rezim model harga janji harga wajar wajar,0,0
plakat isi kerja polisi indonesia polisi tionghoa polisi tolak markas lihat foto kayak selamat,1,0
bela asma dewi bentuk solidaritas kejam rezim anti islam uniform resource locator,1,0
tolol bela nista agama sangka,1,1
minum kopi luwak biar deg degan alias kocak sih bolot pas congor,0,1
hasil nyata lindung ahok dakwa nista agama,1,0
cieada nariknarik gatot nurmantyo saing jokowi nihgak pas tentara nasional indonesia aktif lohkalau 2019 prabowo tinggal,1,0
debat kampret otak rendam kencing onta,1,1
khofifah rupa srikandi nu duduk kursi gubernur jawa timur 2018 damping emil dardak wakil bagus,0,0
pikir nyeleneh tuhan ku cipta anjing babi kitab haram babi sentuh kulit basah masuk haram akal ku kesana baca,0,0
malam pck kerja cocot komersial,1,1
mu gue berita bencongbencong yaelah,0,1
tomohon rupa pusat ajar agama kristen katolik khusus doa meditasi bukit kasih buah suci indah tenang nnnor,0,0
lokalisasi agama nu kalah kreatif kristen protestan indonesia kristen jawa batak p,0,0
bikin darah didih bangsat penuh propaganda islam radikal,1,1
pbb pandang signifikan bagus pasang presiden incumbent lawan gatot nurmantyo amp yusril,0,0
guys presiden blusuk an pelosok negeri jokowi dengar langsung keluh warga sea ecek program perintah nih video pimpin duduk rendah r,0,0
warga badui selesai tradisi seba pendopo perintah kabupaten lebak beemu gubernur banten wahidin halim sabtu 214,0,0
setan sih,1,1
gue celeng bikin synna emosi mancing,0,0
cebong kelojot takjil waras takjil amuk amuk karuanngiliran presiden hina mingkemn,1,1
kampang,1,1
rezim tukang tipu hoaks anti kritik,1,0
cebong kopi eta mahnharga harga beli utang,1,1
tokoh politik berangan perintah berani bicara kasar etika sih prabowo berani bilang elite goblok maksudanda sekolah oi presidenanggota dewan berani bilang menteri agama bangsat,0,1
pikir bayi tabung padu sperma kampret onta ragu,1,1
monyet sumber hidup,0,0
cebong telur 3000an berisik dasar kampret miskin,1,1
selamat sore twit 184 presiden jokowi pimpin rapat batas istana presiden bogor rabu 184 bahas kena cepat laksana usaha online single submissionoss poin arah simak,0,0
selesai impor alat utama sistem tahan brigade mobil mending mundur uniform resource locator,1,0
aww good luck suka pusing bahas budaya populer,0,0
nama gatot saptono al al khaththath status sangka mufakat makar duga dukung anies sandi,1,0
jelang pilih kepala daerah perintah kabupaten garut kebut cetak 116 ribu elektonik kartu tanda duduk,0,0
indonesia hebat indonesia banjir tenaga kerja asing jokowi keren deh top banget presiden umur hidup ayo dukung jokowi solo,1,0
anjinganjing orde kayak tukang ngibulkgk malu ustaz,1,1
indosat tai,1,1
maiyah aman aman masingmasing hadir maiyah prajurit aman ajar aman nyaman bahagia,0,0
butuh presiden takut miskin haahilang kuasa tahta,0,0
ayat dingajikan perintah rang bunuh penggal kafir,1,0
komunis,0,0
,0,0
saudara aji moga allah izin gus ipulmbak puti gubernur wakil gubernur jawa timur,0,0
puisi sukmawati puisi sang iblis,1,1
jijik kunyuk,0,1
otak tara gender telanjang dasar mesum cacat,1,1
jam ih aisya lesbi,0,1
bismillah superior printing harga ecer lgnpolos135kprint ratus puluh ribu lusinlgnpolos 120kprint130k bahan rena dri fit pe sp info order pin 5fd97626 wa 081210090063 instagram sri yono,0,0
udik kasihan tidur,1,1
saksi tani masyarakat ulama perintah dukung program suriah upa 1000 ton beras ahyudin presiden act yuk simak lengkap video,0,0
mesti proyek asing nasionalis pancasilaiskoq pilih asing janganjangan antek asing nih,1,0
ainya bacot,1,1
nyata tol utang jepang 3 jokowi layak makzul turun jokowi,1,0
akulturasi agama daerah niscaya pei kristen jawa jalan bareng tradisi jawa istilah kristen nusantara kristen kristen islam islam isl,0,0
ajar aji ayat cocok cocok penis penggal kafir pahala biadab,1,1
kirim foto kontol fulln tearik video call,0,1
sombong tau he manusia sumber bau bau kaki bau bau udel bau ketek congean korong cileuh bau kepala bau mulut bau karbit jengkol comberan bangkai,0,1
layan 2 kontol security meeting room for the video uniform resource locator,0,1
anjing tai goblok idiot bangsat monyet babi fuck kont kangen goblok nniya tau kasar banget maaf,1,1
menang aniessandi usut komisi pemelihan dkiwalau telat wajar kampanyeintimidasi2,1,0
gue tinggal beli batagor anjir ngaret,0,1
e a k gue mute anjir,0,1
bawang asing nih juragan,0,0
mampus anak langsung nongol,1,1
oum jodoh nnntu pakai pelet jepang dek effektifnnhonda beat honda jazz b,0,0
peluang tokoh ubah lukman hidup allah subhanahu wa taala sesat,1,1
om jilat memek,0,1
anjirnngue ecek kali kali cewek cowok tau tipu kayak video nyata asli cewek nnterlepas gender sih astaga moga adek gue amin,0,1
nniklan bego paai bego pilih bego,1,1
acak acak pahlawan siang gagal kudeta partai komunis indonesia pakai gelar pahlawan,0,0
kubu prabowo nilai negatif bijak jokowi pilih presiden 2019 uniform resource locator,1,0
ngewe kayak,0,1
kampang anjing,1,1
meeting nn tadinnlha berai ajak meeting suruh sih diam kayak patungnnmiskom somplak,1,1
biaya ambil alih mayoritas saham 51 pt fi us5 miliar minimum utang perban asing pegang saham mayoritas taro duit bangun smelter murni bangkit listrik biaya cave mini,0,0
anies ombudsman wakil ombudsman republik indonesia nnombudsman ri ombudsman wak,0,0
lebay duda,1,0
presiden keluh minim publikasi asi games xviii,0,0
angkat tradisi budaya rakyat banyuwangi kunci sukses bec 2017,0,0
pas acara tempo wakil tim sukses aniessandi sih indra j piliang wkwk tukang narkoba,1,0
cowok hobi swafoto beda lekong amp banci kaleng,1,1
salah keberserahdirian menteri agama ekspresi tuhan layan disembah2,1,0
dipungkiri rezim jokowi rezim anti islam,1,0
cebong kampret bilang infrastruktur jalan mahal,1,1
amerika 200000 orang pindah agama kristen agama islam,0,0
nama sandirawa cundang bubar urus ecek ecek berani urus bantu likuiditas bank indonesia rumah sakit sumber waras,1,0
giat bhayangkara bina aman tertib masyarakat aiptu main sembiring sambang thomas masyarakat desa labuh labo pesan aman tertib masyarakat anti berita hoaks isu sara benci sea jaga situasi aman tenaga kerja asing lapor uniform resource locator,0,0
orang orang sumbu pendek protes prabowo tolak sumbang hadap orangorang rohingya,1,0
tolak atur perintah ganti undang undang tolak rezim otoriter atur perintah ganti undang undang pintu masuk lengser jokowi,1,0
gagal paham kena gagal rangkul cuap cuap gagal paham contoh kelompok 212 kemarin presiden aman aman,0,0
wkwk mampus jung ruby,1,1
tong presiden hina,0,0
bicara ahmad dhani monyet babi anjing,1,1
cinta buta cinta dengar lihat fakta pei kotor kucing coklat prof,0,0
mampus kalah lawan gue,1,1
anjir salah tag wkwk gue jennie zumi lisa wkwk,0,1
apes beneeeer jadwal shift pagi 4 besok off lusa shift malam sabtu badan cungkring ampuuuun zzzzzz,0,0
koruptor teroris langgar ham beratkoruptor bunuh rakyat pelanmembikin rakyat miskinbodoh hilang hak struktur sistematisrakyat gizi lapar dewan wakil rakyat sibuk korupsi,0,0
tuju pasang jokowi tuju coblos pasang,0,0
batal putus sikap syahrir ubah cegah tokoh paai tionghoa indonesia teguh,0,0
bunga melati bunga bangkai,0,0
bubar amp usir yordania,1,0
presiden sistem izin usaha integrasi terap a i a presiden izin usaha integrasi diterapkana,0,0
ahok orang nista agama,1,1
ngei gue nikmat orang orang sengaja desak desa angkut senggol bokong doang,0,0
bacot reza urus anak istri gara gara reply galau,1,1
gue sipit sipit mata barangkali warna beda,0,0
pasang jepret racun tikus coba perhati rumah sisa makan sera sampah cecer heran tikustikus liar tikus masuk rumah tearik bau makan non,0,0
dungu km make gelang perkara intimidasi langsung km libat gelang duga bentuk konspirasi,1,1
kampung nagita slavina reaksi ayu ting ting uniform resource locator,0,0
pacar agama muslim hindu buddha lucu,0,0
tragedi 98 nyata salah upaya komunis prabowo,1,0
tau jaman megawati korupsi jaman susilo bambang yudhoyono uniform resource locator,1,0
pasang calon gubernur wakil gubernur unggul malam,0,0
prabowo hormat tampil pei orang cemburu kalah,1,0
jokowi mundur jenderal bantai 2019 pilih presiden,1,0
peang sayang cinta bolot sok pintar lot gue,1,1
sarap bro,0,1
lihat salah dukung mafia koruptor nista agama gerombol banci titot laku bidik arah,1,1
ngawur nih rezim indonesia cina nih negara,1,0
retweeted uus rusdiana salah 1 kabupaten jawa barat dukung gubernur kang presidenwakil presiden ri nyata putus ms partai adil sejahtera,0,0
beda banget adinnkalo adi mahnntuh kak lihat gue bilang berengsek nnyha uniform resource locator,1,1
partai politik sih usaha keras jegal kesah undang undang takut presiden atur perintah ganti undang undang tarik lihat presiden kasih ancam langsung diam ketok palu tok tok tok,1,0
ah bacot dasar sok alim manusia sempurna sok alim orang,1,1
gembok akun udahgak tebar databerkali kali main datalo data gembok akunnsehari 2 kali gembok akunnpayah cebong cupu,1,1
nyolu sipit bikin grup,0,0
inti pas kampanye koar koar henti terbit atur gubernur barumunafik km bilang kampret,1,1
kadang kemarin follow tara unfollow follow geblek manusia,1,1
1142 situasi lintas jalan gatot subroto gedung mprdpr arah slip pantau ramai lancar,0,0
makan siang mi ayam kampus jual layan tonton bareng jojonhalah kesalipnhalahnhalahn,0,0
nyata katanyakatanya hafiz tau cebong,1,1
ngentot yu rl gampang sange,0,1
jam gin ganti baju gembel rumah tanda kemanamana,0,1
km laku patut km laku urus pribadi sel,0,0
ayo penjara koruptor sumber waras,1,0
sok peduli rohingya,1,0
blur kampret,0,1
cewek lelaki itunbrengsek guys brengseknberbanggalah brai laki,0,1
rupiah anjlok ulah hidup terima kebaikanselalu isu negatif contoh isu partai komunis indonesia tax amnestiwslm,0,0
diam kampang sakit kepala,1,1
berai sala cebong pintar2nna sih kampret gimnandari maju maju otak udang pakai gede badan doang wajar petinggi petinggi kampret pinda haluan,1,1
partai demokrasi indonesia juang mega bangkit komunis,1,0
sadar cacat hasil kerja tim besok dday time to sleep guys,0,0
babi sialll,0,1
income negara sektor bagus ainya negara uang jokowi hutang bangkit ekonomi bangsa paksa hutang pasu bagus simple,0,0
bilang kristen wudhu,0,0
orang mobil gerak idiotnnwindy kesal yoga peka kondisi perut diam tatap,0,1
congor persis congor onta,1,1
babi anjing mampus kalah jatuh miskin deh bekas sah,1,1
presiden uefa dukung hadap usir gianluigi buffon michael oliver,0,0
dewan wakil rakyat as a service,0,0
warga jawa lupa,0,0
lupa gereja bom 2 minggu takut pilih ibadah,0,0
latih ribet kang bacot mulu kerja,1,1
moestopo kuliah rusia pulang huru hara partai komunis indonesia agama nama salah,0,0
salam ustaznak tanyaapakah hukum bab jual beli beli jual akad pei jual beli,0,0
mending jokowi mundur uniform resource locator,1,0
sih rexy tai,1,1
katakata bodoh dungu idiot teknis acu orang nilai intelligence quotient 70,0,0
kena beking tarik solusi berantas nelayan asing tenggelam nelayan kalah singkir usaha,0,0
oi manusia homo nih,0,1
gembel fatwa tabi,0,1
abg sange telanjang masturbasi nn,0,1
pejam tunggu tampar terima tampar buah suara asing orang lakilaki masuk pendengarannyaneeeeeh nn buka,0,0
mundur jokowi,1,0
paai sompret bubar pilih,1,1
queen coba memek,0,1
prediksi polandnkamis 29032018nas5 6 3 2nkop1 4 7 9nkepala8 2 0 5nekor6 3 1 4n2d86 23 01 54 83 21 04n3d965 amp 451ncbn8 amp 4ncm31 62 45nshioayam amp monyetntwin11 33 88nbbfs7 4 1 9 5 uniform resource locator,0,0
salah janji jokowi tuntut paham cebong,1,1
menteri hukum hak asasi manusia kena md3 hak imunitas debat undang undang pilih kepala daerah ketok palu presiden atur perintah ganti undang undang md3 presiden tanda tangan,0,0
merek yahudiisraelus saham owner saham istilah suppo teentu sih,0,0
ajar sumber kitab weda beda tafsir 5 dasar percaya percaya brahman atman karma reinkarnasi moksa nkl ritual raya sembahyang,0,0
bilang baca bilang seru alah kirim kampang,1,1
negara perang orang orang munafik syiah komunis kuasa,0,0
bom pelukmasa,0,0
cowok berengsek,1,1
turun jokowi rezim korban ahok,1,0
driver ojek temu keluarga orang pesan ojek langsung tabrak bacot olah olah tukang ojek hina banget,1,1
gue gue doang bangkai sinyal ganti telkomsel orang miskin,1,1
peama rezim bijak protes kuasa pura pura dengar paham kritisi a,0,0
wkwk najis gue pilih oke lihat lihat kali,0,1
jabar mudah mudah tingkat ekonomi masyarakat,0,0
pnh kerja asing manfaat terap sekolah dominan enggan,0,0
resmi izin program studi s3 islam nusantara satusatunya program studi s3 konsentrasi islam nusantara indonesia,0,0
pilih nih calon presiden,1,0
negara ekonomi surat pemberitahuan republik rakyat cina us jepang utang sewot ri utang berani utang berai negara percaya kelola,0,0
beda paham kulititangkap sih cina,1,0
berai cebong wkwk dasar iq 200 kolam,1,1
sukses bajing,1,1
beda institutionalized religion agama diarusutamakan kultus kontrol teentu agama arus utama islam majelis ulama indonesia jaga sesat,0,0
sehat jalan jalan aktif lo tebar pei presiden ri manggung kandang bosan ketemu fadli zon,1,0
jokowi citra pilih presiden perkara harga saham mahal poin poin prinsip pakat urus pilih presiden metode kerja rezim jokowi pei,1,0
indonesia kuat ke5 dunia bidang ekonomi teknologi militer bidang minimal indonesia peringkat ke5 dunia dukung presiden ri 20192024,0,0
ngewe cepat desah doang ngewe knalpot kendara,0,1
nasib cebong mimpi orang orang otak berak kayak,1,1
dasar cebong ih,0,1
indonesia kayak raya manfaat asing kaya,0,0
celaka sukmawati tiada mengei syariat hidup ssatncelakalah sukmawati aurat urai buruk wajahkuncelakalah sukmawati nyanyi genjer genjer suka iblis disukmakuncelakalah sukmawati azan usir iblis disukmakunsukmakumati,0,1
cacat anjir nama gue kayak rambut limbad,0,1
gara beda langsung pecat rejim anti kritik masuk parlemen,0,0
nikah muntah congor pakai acara jijik jijaynnmampus disaltyin,1,1
tolol sangku paut bilang kecut dasar tolol,1,1
budek sih gendut,1,1
lokal merek global bidangndalam agama indonesia hindu nusantara beda hindu dunianapakah hindu nusantara hindu dunia lemah hindu dunia berkem,0,0
cina janji kebut proyek kakak cepat jakaabandung ekonomi,0,0
mending jokowi mundur deh kayak negara atur orang menteri anjing,1,1
rachmawati soekarno lempar sembako rakyat hati iris anggap rakyat dilemparlempar sembakosouvenir kaca pimpin ayah beliau laku,0,0
simpul bego v,1,1
nih calon calon wakil presiden mud tua bangkai kuat cuit juganih,1,1
serang pandang beda bubar komisi berantas korupsi benah komisi berantas korupsi selamat ketua,1,0
meteor garden cina,0,0
2 nomer indosat pulsa barusan tau pulsa rupiah 0 dipaken bangkai nih,1,1
berani ngentot lobang pantat pantat lobang rem,0,1
sampah visual kondisi,0,0
partai komunis indonesia bangkit,0,0
allah subhanahu wa taala benci kafir ajar cocok cocok penis istri gemar azab janji rampas,1,1
lin iqna karya seni muraqqa album era mongolia iran pamer depaemen seni,0,0
anjing komunis tolol,1,1
orang bodoh percaya prabowo dalang 98pdahal dalang dalang orang jokowimakanya ham 98 jokowi proses know bohong o,1,1
monyet pas universitas didik indonesia hidup yi wkwk,0,0
adopsi cerdas potensi ekonomi digital capai 23 triliun dolar as,0,0
burik,1,1
gue kasih tau bang kasar keset jeyepennjangan sombong tai onta,1,1
by the way fase peanyaan2 ateis dorong iman tkt ihsan insyaallah goyah hadap bani ateis liberal,0,0
cocok langit bumi kampret cebongtapi adem cebong,1,1
nyata sikap pilih kepala daerah damai anti hoaks warga desa lae luhung kabupaten dairi,0,0
orang mang salah pilih kalah menang rezim sengsara rakyat komunis,1,0
berisik salah tokai onta bani cabul,1,1
gue menelngua suka modus siningua brengsekngua anak baikbaiknntapi nnsekali gue sayang anggap palsunsekali gue serius main hati gue,0,1
ppp buruburu tolak wacana pilih kepala daerah dewan wakil rakyat daerah,0,0
munafik butuh visual tarik nonfans we need yireon sakura wonyoung yoonjin jual tampang doang bukti sukses center suara oke,0,0
qaumi ekajati conference jamiat ul ulama e hindjanab muhammad ali shabb,0,0
najis allah seram,0,1
suasana hati antuk kena ajar besok exam nih tikus function kena ampas putus putus kena kasih patah,0,0
najis belai jablay,0,1
komisi berantas korupsi semrawut goblokbubarkan c ambang sajahahh haram uniform resource locator,1,1
bangkai om,0,0
jalan salib kota ambon potensial objek wisata religius,0,0
suruh mundur jokowi bilang zalim gatot,1,0
bom wtc minyak irak kabar,0,0
orang kiri komunis sosialis marxis mental khianat ajar anti agama buang nntapi banding 1 99,1,0
gerindra antek orde kkn,1,0
ahmad dhani hormat babi anjing kontol lonte tunggu karier mu habis,1,1
nete 5 menit anak lulove pingsan,0,1
8 anakanaknaktivis jabat rencana usir warga palestina area luas mukim ilegal yahudi kefar adumim yerusalem tepi barat,0,0
bini senantiasa kurus putih nikah bihun taplak heran laki model gitunn9 tahan sakit derita nyinyir orang urus rumah urus suami lahir anak muntah,0,0
cowok ganteng six pack pamer kontol urat kamar uniform resource locator,0,1
presiden joko widodo 34 proyek bangkit listrik mangkrak,0,0
hai kampret goblokidiot bin pekokkau baca ininpekok pelihara peet kampretnmasih msu sehat turki israel hubung diplomatik uniform resource locator,1,1
goblok kunyuk,1,1
jembatan fenomenal pandang fenomenal pulabravoo presiden jokowi bangun jembatana,0,0
sulit bangsa indonesia informasi jati presiden jokowi chirpstory,0,0
komisi berantas korupsi henti bagus dewan wakil rakyat bubar bos,1,0
asing nih forever young dengar ulang ulang sial musik video,0,0
menteri agama biar tipu muhammad sesuai alquran,0,0
cari sumber berita bantu kasih link website resmi bangun bandara rencana groundbreaking 2016 jokowi,0,0
ateis kenal tuhan,0,0
barel bom wilayah kampus kena,0,0
tangkap ahok tuju,1,0
prof bahas fiksi singgung agama teentu ramai olah olah nista bu suka rendah azan hijab syariat islam koar situ sehat,1,0
bantu deh cari sendirinnislam kurban sapi kambing onta nninus kurban ayam burungnnnah lo inussedangkan burung korban,0,0
kau kanal bainanal habib ulamaa sepakat selawat terima rangka mulia rasulullah saw sair o ou o ouu o o c o1u ou ou ou o ou oau o,0,0
warga badui selesai tradisi seba pendopo perintah kabupaten lebak beemu gubernur banten wahidin halim sabtu 214,0,0
foto intip jamban jadul koleksi museum jepang bangsa peama jamban,0,0
ribut islam nusantara sekolah islam padu auto kafir nn,0,0
tokoh islam prabowonpaai islam gerindrannkntl,1,1
gempur isu sara isu partai komunis indonesia fitnah jokowi kokoh cinta dukung rakyat tulus beliau kuat,0,0
lelaki ngentot mami bosan jepit pepek mami bilang puas mami,0,1
sekolah negeri islam kristen tok ruang kelas agama kasih gudang bocor bolong bolong deh,0,0
astaga coba kasih foto beforeafternya min,0,0
70 juta dukung jokowi menang pilih presiden 2019biar kaum sumbu pendek kejang kejang,1,1
silaturahmi imam masjid istiqlal,0,0
pas gue tabok sih edi eh tio bibir gue menyon barbar sih kunyuknn chandra uniform resource locator,0,1
bicara kristen bel,0,0
kristen nusantara buddha nusantara alir,0,0
bikin ambang batas rezim prihatin eh salah jokowi,0,0
ahok tai fitnah tukang caci maki perempuannn anjing,1,1
people teriak teriak ganyang partai komunis indonesia jaman tonton layar tancap film gera 30 september partai komunis indonesia duduk,1,0
nyata butuh sih monyet masuk kandang uniform resource locator,0,0
daya tarik utama konsumsi buah iblis khusus,0,0
tai rakyat jelata wenang wenang derek gilir anggota dewan wakil rakyat daerah eeemelawan bukti mata hukum,1,1
tai,1,1
ahok jabat gubernur labrak rumah sakit,1,0
kebaji konghucu lukman ajar cocok cocok penis 4 istri penggal kafir,1,1
prabowo nama nyaselalu pecah bangsa uniform resource locator,1,0
kristen kristen jawa kristen batak kristen toraja kristen timur kristen batak batak batak simalungun nyelew,0,0
ku manisntapi iblisnkau pikir kau,1,1
mantap presidend horas jokowi periode,0,0
abu janda lapor polisi daerah metro jaya kolega sih gun kitab suci fiksi alamak ayo abu janda lapor sih gun,1,0
beliau warga katolik cek direct message,0,0
