abg generasi micin hafal gesek kontol memek nikmat uniform resource locator,0,1
sitip nih sitip,0,0
lengser jokowi biar lihat goblok,1,1
mahasiswa koplakcuma modus rakyat indonesia 250 jutabukan 25 orangsontoloyo,1,1
titit titit hambur,0,1
hyunjin kejar kejar kayak film hollywood lempar bom,0,0
lesbi anggap salah salah cinta maaf nih normal tanggap lesbigaybisex salah hidup damping orang orang pandang belah,0,0
junjung jam 1 bilang gebuk jam 115 sweeping partai komunis indonesia,1,0
muslim menteri agama wajib jujur isi alquran,0,0
kang sudrajat syaikhona dukung ulama jawa barat insyaallah gubernur jabar 20192024,0,0
eh partai komunis indonesia miband haha tinggal zaman jam besi mira,0,0
edan pbg purwokerto ngeles,0,1
kasihan nih cewek cewek tonton bokep lihat atlet buka baju langsung sange,0,1
ngentot enak crot,0,1
anggota dewan wakil rakyat potong,0,0
negara pimpin orang paham kelola negara lengser jokowi,1,0
chadli cacat mala dembele ganti cacat sih,1,1
komisi berantas korupsi periksa gubernur calon wakil gubernur sumatra utara ijeck sah,0,0
ruhut prabowo strokenfadhli zon ruhut gila,0,1
wooyyy anjing lacur laku bejat dasar anak haram wkwk,1,1
bahan bahas 5 kedepanbukan showtime doang acara 3 makhluk kampret heboh fan belas sinting,1,1
buku lawasgt peran agama moral bangun masyarakat ekonomi indonesia syafruddin prawinegara 1966 32 halhrg 150000 minat,0,0
njinggg bencong gaya pakai blok blok wa,1,1
ceramah kalang internal muka agama mengkhutbahkan kayak istilah kafir non muslim agama islam domba sesat agama kristen dogma agama,0,0
cewek lelaki berengsek guys berengsek bangga brai laki,0,1
provinsi gorontalo visi misi gubernur sektor ikan laut salah program prioritas tingkat ekonomi rakyat bangun sektor ikan laut harap,0,0
pulang mama pacar suruh main kesininyaelah anak tergilagila orang kuriahh,0,0
adakan nyanyi district jablay,0,1
ampun adem banget nih saudari fungsionaris,0,0
headline transaksi tunai batas maksimal rupiah 100 juta ekonomi ganggu,0,0
freepo ganggu gugat rezim orde bikin janji abadi,0,0
x maksud rg al alquran al alquran kitab suci x maksud ahok maksud nista agama lo x oi bohong dasar kafir,1,1
gubernur indonesia,0,0
besok prabowo calon presiden teriakteriak negara republik indonesia harga mati percaya,1,0
ogah presiden kacung orang presiden kacung,1,1
rakyat curiga rezim antiislam uniform resource locator,1,0
rakyat hidup susah rezim jokowi rusia,0,0
berak,1,1
lihat setan takut tau setan cari saudara goblok,0,1
sih pakai rohingya serang,1,0
kayak sihkadang umur rokok orang tua b bicara kayak kayak bicara gue bicara anjing kontol marah,0,1
haha mampusnnselamat galau ria,1,1
berani bilang isu saracen goreng serang lawanlawan jokowi,1,0
kampung dukung agus harimurti yudhoyono,1,1
warga semarang prihatin kontroversi puisi gus mus,0,0
model seksi ngentot direct message gue pret detail fr bule,0,1
persetan bocah kontol sok rad kecewa sekolah ganti nama sok mes tongbiar cobannsekola kerja pacarantidur jajan sok sok an bilang harga,1,1
layak bubar referendum rakyat bubar dewan wakil rakyat,1,0
setan usak diet,0,1
lapor brai fix gerbong,0,0
kampret,0,1
terima putus presiden partai komunis indonesia muncul gebuk,1,0
minggu peama digitasinminggu rektifikasi proses pbb layouting pbbnmenyenangkan kp disininbisa ajar map info global mapper arcgis autocad cacat apps,0,0
aduh mata gue sipit banget im not a cina myself aduh sabar adik,0,0
terima kasih gubernur puji,0,0
islam pakai huruf gede wowntenang buta mata buta hati hilang nuraninkau pilih semaumunjadi pilih semaukunadilkan mengei makna adil,0,0
indonesia palsu tanah lacur,1,1
tim 1 pakai usaha produce orang 0 titik teinggi tim 2 perform lancar cacat lihat darimanapun tim 1 bagus men,0,0
presiden jongosslalu tunggu aba tuan cina nyaapalagi bantai muslim cina kafir,1,1
bani kampret otak micin bea om bud perintah mesti duit freepo habis kontrak om bud bantu,1,1
nih gue lengkap video kitab suci fiksi nista agama nama,1,0
gus dur sikap orang pimpin muslim ramah idealis cinta beda pluralisme keren,0,0
mantap,0,0
salah jokowi rezim jahat diktator otoriter komunis kafir zalim organisasi papua merdeka uniform resource locator,1,0
,1,1
komunis keren,0,0
untung presiden jokowi beliau nih bandara mangkrak jalan terima kasih presiden salam 2 periode,0,0
kepala unit bina masyarakat inspektur polisi mt hutasoit laksana sambang pesan pesan aman tertib masyarakat pilih gubernur pilih kepala daerah 2018 karyawan bank rakyat indonesia ranting muara damenra silit kawan kawan desa hutanagodang camat muara kabupaten tap utara,0,0
isu terpa pei feminisme rasialisme lgbt kayak film mulan frozen remake live action cantik and the beast salah kuat film animasi disney lagu lagu bikin tonton sing along senang,0,0
seriawan hamid marah nilai presiden amp jajar potensi penghianat bangsa kutuk kelak petaka negeri,1,0
rezim plonga plongo kacung chinauda plonga plongo dungu haha,1,1
bom jiah,0,0
jalan sipit tinggal,0,0
gubernur bangga bangsa indonesia,0,0
i added a video to a playlist,0,0
bangkai wkwk kayak habis putus ngiang ngiang mandi kucing eeeeeee,0,1
haha bikin tonton sarap dad main main gitar,0,1
jokowi anti islam usung lawanlawan politik buzzer rezim,1,0
barometer terang pilih kepala daerah daerah khusus ibukota tahan 60 tumbang kotak pilih hasil gubernur bawa rahmat semuad,0,0
dedah,0,0
ngeles om anies sandi,1,0
allah subhanahu wa taala paham toleransi buang ajar toleransi indonesia gabung sabang merauke 2016,1,1
sedih pas makan siang lihat sendok pasang garpu taplak pasang,0,0
banget rezim antiislam antiulama bukti uniform resource locator,1,0
cupu bawa bawa squad,1,1
tuju usir turun arab india cina masuk zul uniform resource locator,1,0
dokumen hasil tim cari fakta munir hilang hilang nyali politik jokowi era mega,1,0
ayas kunyuk,0,1
badan awas pilih nyata partai adil indonesia lolos penuh syarat pilih kepala daerah 2019,0,0
2 presiden indonesia negara kokoh kuat ulama umara iring sea jaga tali silaturahmi,0,0
cepat lo jijik woi tahan napas pas kejar kejar,0,0
es degan negara duta israel jalin hubung diplomatik jokowi jalin hubung diplomatnesdegan antek yahudi,0,0
salut ikhlas sedekah habis dana miliar,0,0
kunjung anies turki tuai puji ribu warganet gubernur presiden lengkap,0,0
kayak kutuk,1,1
hebat ukur kadar iman orang kadar lihat golong orang picek mata hati,1,1
orang gila ganggu mental orang logisn,0,0
sih somad minum kopi strabucktp bisamad somad minum kopi yuuuktrus entar gue tampar cocot biar monyong,1,1
ganti presiden calon,0,0
deklarasi pilih kepala daerah 2018 aman anti hoaks warga panggreh jabon,0,0
2 teriakteriak jokowi diktator teriak kayak hidup nyaman ironis gue,1,0
sinting sih main sepak bola jual bahan kimia uniform resource locator,0,1
uji sekolah sekolah dasar didik agama islam pai,0,0
anjir fuck kontol kuda uniform resource locator,0,1
islam nusantara taming komunis syiah liberal hancur islam indonesia,0,0
partai adil sejahtera antek komunis,1,0
patung tugu tawar besanding lokasi simpang kampung kagungan ratu camat tulang bawang udik lampung,0,0
angkat tangan gerak serius sumpah,0,0
laku o rezim perintah apresiasi sisi kerja rumah selesai moga periode 2 tingkat deh berani benah kerja rumah,0,0
a ajak ulama dingin situasi sejuk situasia presiden jokowi,0,0
ahli ekonomi dengar cetak uang inflasi rupiah harga cetak sesuai nominal admin spei mohon koreksi salah,0,0
ngakakngatain noob wkwk eh by the way out ena bang,0,0
kali angkat jempol isi nyata tindak aksi tes the water bela agama sejati abalabal dukung nyata,0,0
marah kasihan kerja keras bacot diam kerja keras bacot bau mulut,1,1
lupa terima kasih presiden jalan negara jamah aspal mulus pos lintas batas malu serasa surga,0,0
cont phoebe tatap intimidasi ramah orang asing beemu ilya gendong hadap tangan mungil,0,0
suruh sih munawar mimik kencing ontanmunawar munafik,1,1
bisatapi ejek kafir komunis antek asing,0,0
rebut saham utang lagiutang lagitukang tipu duit pinjam pakai citra somplak rezim,1,1
scamming urus bego orang butuh,1,1
orang teawa gila orang teawa waras,0,0
tangkap bunuh bajinganprcma harap tegak hukum,0,1
eh bang perek lihat,0,1
game angkat film bagus coba assassins creed kacrut residen evil oke,1,1
pasal babi baca last twit uniform resource locator,0,1
anis menang gurun pasir onta,1,1
jancuk,0,1
sih dongok tumpang makan rakyat kerja nyinyir,1,1
sih emak ku bilang tertawa kayak kunti,0,0
patut tunggu nnbani hoaks bangun ahok pei nelson mandelannpeanyaan malu ahok tahan lupa pei mandela nnmandela pahlawan ahok pimpin suka marah marah,1,0
basmi perhati orang sih onta,1,1
ganyang partai komunis indonesia wajib jaga negara republik indonesia pancasila uniform resource locator,1,0
keren waeg pakai taplak meja,0,0
pikir agama asli indonesia islam impor kristen impor hindu impor buddha impor yahudi impor komunisme impor impor alir animisme dinamisme pelihara alir jahiliyah x,1,0
anjir pikir kocok,0,1
ku negeri masuk favorit favorit minoritas minoritas 5050 muslim amp kristenkatolik kelas sepeiga gituga,0,0
seni budaya,0,0
orang orang ahok p jokowi anggap hina islam kepleset lidah bela bela agama niat hajar lawan politik agama alat transaksi politik mal,1,0
kuda onta wkwk,0,0
dasar cina goblok bayar kucing gembrot model,1,1
biar sakit kudis beapak barah obat amin nn uniform resource locator,0,0
halo skripsi transgender coba cari website suara lgbt jakaa km yogyakarta km coba lembaga swadaya masyarakat kebaya good luck,0,0
haha bisu tau orang bisu roman tangan nak je beli kuih raya,0,0
even ustaz serban jubah putih drive celaka golong golong babi anak anak,1,1
peci dadak ulama dadak singgah pesantren dadak sahabat nabi kitab suci fiksi dadak bela islam salah 411 212,0,0
media oposisi jokowi mundur negarawan uniform resource locator,1,0
siappppsbtlnye tunggu 2019 cepat jokowi lengserkansblm negeri kacau balau,1,0
contoh lihat bayi lahir cacat lahir x sempurna bayi tanda allah zalim hamba allah x tau sabar uji allah,0,0
gue nih asli geblek suruh kasih saran kritik asli nnso far bagus bikin penasaran gue kayak cepat banget narasi kali,0,1
aduh kesan insensitive sis gede gede bom tempo asosiasi cadar negatif eh,0,0
kerja bani tlembuk stres akibat jago nyungsep jabar jawa jawa timur,1,1
sinergitas tanggulang terorisme badan nasional tanggulang terorisme polisi daerah bal rangka sukses pilih kepala daerah serentak 2018 tahap pilih 2019 wilayah provinsi bal badan nasional tanggulang terorisme badan nasional tanggulang terorisme,0,0
men mensiv uhu mw brojol moga langgeng tengkar tengkar kayak bom bom car moga panutan gubya mwaaaa,0,0
wayang golek mar keluarga hina dorna orang suka hadap mar keluarga maaf maaf langsung,0,0
sih cina babi ahok banget sok pintar banget ahok,1,1
susu kontol manis susu kental manis,0,0
cebong norak,1,1
paham hadis potong potong mulut bau pesing ajar hadis air kencing onta,1,1
ups 2 x ngentot kontol kakak ngaceng,0,1
habis kerja 11 tk rumah nasib bujang kawin mampus bini sangsi rumah bini no 2 haha,0,1
benci cemburu seringkali bajing mengoyakngoyak isi hati baikbaik si,0,1
biar edan lil,0,1
malam salah wkwk,1,1
kecewa bisu,0,0
pas tegur deh tau mata pakai sipit sipit terka terka tegur wkwk,0,0
tai kucing siriknnemang ganggu nndiem cuk,1,1
rajin salat amp hijab hukum wajibnkita tau lesbi alas bikin kayak orang paham asa asa pandang allah,0,0
solo susilo bambang yudhoyono 10 jam kampung bin udik parah 25,0,1
hancur pdipbesea antek 2nyakumpulan kafirun munafik,1,1
babi ahok ejek onta biar injak injak onta,1,1
presiden joko widodo resmi cabut 14 proyek daftar proyek strategis nasional play station network alasannyaa a a a,0,0
,0,0
orang mengatasnamakan muslim picik surat pemberitahuan yahudi,1,1
tolol,1,1
ngewe pantai kayak enak bro,0,1
jelang pilih kepala daerah anggota polisi sektor tegalrejo polisi resor magelang sambangdds tokoh agama seaa,0,0
anjir mati listrik pulau nama euy,0,1
budaya sunda bikin mahasiswa asing jatuh cinta,0,0
sih orang pintar gila mati mati mati langkah ketua,0,0
rakyat paham hoaks golong kampret rakyat paham kerja perintah dasar sampah,1,1
berisik jablay hebat,0,1
mending berita menteri joko jokowi mundur gagal hadir perintah kualitas minimal ber intelligence quotient,1,0
1988 wilayah palestina kosong palestina salah propinsi khalifah turki usmani turki hancur sekongkol yahudi dukung ronta kemal attaturk,0,0
gubernur daerah khusus ibukota hormat kasih saran tpa sampah apaemenrumah mal,0,0
berengsek boyfriend kuat,1,1
pikir baca kannntapi sadar sadar sih sadar terima lgbt baca fan fiction mudah imajinasi bias other bias bxb yahhhh deh pokok,0,0
rezim halal gara gara duitnrasa malu jabat putus kayak nyankadang ciduk blunder tabrak hukum parah nih rezim,1,0
pakai rempel taplak meja prasmanan biar seksi konsumsi,0,0
tuhan pilih gubernur lari arab cong nelo bencong otak idiot hina banget hidup cong,1,1
dewan wakil rakyat daerah sibuk terima suap kandidat partai politik dukung pilih kepala daerah langsung hapus,0,0
gue noob,0,0
shua saudara kunti oppa,0,0
bocah jaman now colok memek becek nn uniform resource locator,0,1
edan retweet 800,0,1
ganyang partai komunis indonesia perang buka generasi partai komunis indonesia umat islam,1,0
kader fitnah jokowi antek komunis contoh tau main isu partai komunis indonesia,1,0
sih bego nama internet aduh goblok,1,1
kasih kendorkalau bubar organisasi masyarakat eh mimpi umrah tenaga kerja indonesia sih,1,0
cinta kunci hati cinta hormat sayang cacat milik pasang tutup nbeengkar api sekam syukur terima,0,0
gue tau tau picek swafoto,1,1
titittititnya tamasya tai ah,0,1
mantap maju binasansalam cebong mania,0,1
pets khusus kucing anjing longstream niche salah affiliate amazon niche kucing anjing jual pakan aksesori,0,0
eh ngentot marah,1,1
ruhut prabowo kebelet calon presiden komentar uniform resource locator,1,0
kereta bandara tai banget sih ganggu jadwal kereta listrik,1,1
koruptor lindung komisi berantas korupsi bubar bawa negara perintah koruptor,1,0
berita gubernur banten eksplorasi panas bumi batu kuwung jalan terbit panas bumi news,0,0
anak putri langit bisu langit biru milik robot sair,0,0
jaman kuliah menu ampas enak magelang masak mas,0,0
cebong dongok otak jongkok,1,1
zaman orang orang munafik kerja orang orang kafir runtuh islam,0,0
gusur paksa langgar berat ham utama hak ekonomisosialbudaya situ hak huni layak hubung novel baswedan,0,0
transformer mobil ubah robot uji nasional bas komputer orang pintar ubah haji bolot,0,0
orang spi ontansetau united state of america amp yahudi pakai otak pakai onta,1,1
anjing komen mention cebong budug takut anjing,1,1
waspada nama ham ujung k,0,0
bangsat baca bangsat,0,1
paham cewek cadar cerita kali kasih tau cerita minum anjing pelihara anjing paham dasar banci asli cowok samar cewek cadar uniform resource locator,1,1
status kafir relatif gantung tinjau sudut santai,0,0
desa udik definisi universal buah aglomerasi mukim area desa rural indonesia,0,0
takut salah fokus kayak sekarangnkatay 10 ribu lapang kerja nyata asing,0,0
ajar kayak tau budaya palembang cari,0,0
gilir butuh sok ngebaikbaikin gilir butuh diemdiem jelek setan,1,1
gue kasih info awardee beasiswa asing tar bocor australia,0,0
undur undur fc culun tim hebat lawan persib undur haha fuck joko driyono,1,1
semarang kaline buteknsing sayang mata picek,1,1
foto asma dewi aniessandi ruhut terang benderang uniform resource locator teriakteriak bunuh ahok,1,0
masuk nikmat penjara anak alay modar,1,1
wadaauuu oi kalem woiisabar sabar tunggu gara gara sih sipit keparat kebal hukumemosi rakyat trkendalijejangan strategi,1,1
suap makan lezat ejek gendut maaf hina sahabat choji akimichi,0,0
presiden threshold 20 zalim demokrasinpembatasan calon threshold 20 batas layak orang calon integritas calon ketatanegaraan antek asing asing dstx,0,0
tipu tai gue sumpah berkah hidup anjing,1,1
babi perangai babi uniform resource locator,1,1
anak culun beda tipis,0,0
kangen bajing,0,1
usaha hindar cela pei korupsi kolusi nepotisme jahat negatif lainnyanntidak pei rezim usaha ininnhehe,1,0
alquran orang orang muttaqien memakimaki orangorang ingkar kafir musyrik,0,0
usir cina cina indonesia indonesia kuasa bebas jajah,1,0
inti bacot,1,1
antek antek wkwk malu ngehype wkwk,0,0
onta gue pakai nos mbak 1 jam tenang,0,0
jokowi pamer dungu ranah publik kuar uniform resource locator,1,1
henti ngewe dunia lucu,0,0
kemarin gubernur pilih umat impor bawang cina riak antek asing,0,0
ciri khas cebong melekatkalah data faktalangsung otak porno,1,1
sabar laksana tuhan orang dosa orang kafir,0,0
korelasi hindubudha masuk nusantara maafsaya paham alur otak kaum cebong,1,1
kuat gembos rejim takut rampok kaya ri takut bangkit bangsa bangsa daulat makmur amp kuat pimpin,1,0
mustahil rezim berani laku,0,0
tarikulur kait beda pandang definisi terorisme fraksi fraksi dewan wakil rakyat,0,0
bati tonton bola angin masuk euy,0,0
pilih 2 stop dana hutang uang,0,0
babi buta tito bela jokowi pungut liar lingkung polisi geliat sadar,1,0
help desk padu komisi pemelihan ri bantu selenggara pilih kepala daerah 2018 amp pilih 2019 konsultasi sila hubung 021 31902573 31902583 langsung ruang help desk lt1 komisi pemelihan ri jalan imam bonjol no29 jakaa seninjumat 08,0,0
gue uji nasional pilih sosiologi fi sekolah mantap mata ajar ilmu sosial bangkai,0,1
masuk atm lihat kondom jatuh milik sih empunya buru buru ngempet ngewe lupa bawa uang ehe,0,1
kampret tolol orang kayak susah ngei2nlo copy paste lengkap malas gue bahas sodor copy paste gambar tau sumber payah,1,1
manusia sinting uniform resource locator,1,1
biadab teroris buddha myanmar bakar alquran,1,1
primata tau eh embrio cebong keluarga surat surat lengkap gue bayar eh tolol hidup pikir lihat goblok dungu,1,1
mundur jabat presiden,1,0
laptop jangkit virus babi laku,0,1
samlekomnlu tidur dengar lgunabis mandi guandari acara temenntidur kennntar sakit wkwkkwkwkwkwkqnk,0,0
sederhana identifikasi bajak agama ayat ayat suara damai musuh ajar ajar ria hati tenang hati panas,0,0
bacot mulu tenaga kerja indonesia tenaga kerja asing urus anggota tata kota ngei lihat daerah khusus ibukota amburadul tats kota,1,1
muka kayak tahan tai jack,1,1
lihat orang indonesia jalan kaki pandang belah mata gilir orang asing jalan kaki negeri takjub habis habis wkwk,0,0
sila duduk sih mbak panggil koko alas utama mata sipit nikmat,0,0
keren,0,0
masyarakat keluh kerja anies banjir pimpin mantan gubernur ahok sukses musnah banjir jakaa berita link jp reader tanggap tangan banjir,0,0
ateis percaya surga neraka hangat,0,0
gede tau kemarin sih banci eta trh wkwk,0,1
1 kivlan zen oceh siang transfer uang prabowo dramatis indonesia lawyers club isu partai komunis indonesia masyarakat cuat indonesia lawyers club partai komunis indonesia,1,0
sih hidup nebeng cinacina milik jongos cina sih paloh bewok,1,1
edan marah,0,1
usir cina indonesia rusak bangsa uniform resource locator,1,0
memek becek,0,1
rezim upaya cuci otak generasi lupa sejarahseakan2 hebat mi tuhannrezim kacang lupa kulit puja asing anjing anjing komunis,0,0
suyanto mitra surat perintah henti sidi kur bank aha graha international optimis progpemberdayaan 142 padi hitam amp 70 padi putih potensi panen varietas capai 9 tonha gabah kering program lestari tradisi masyarakat tani jawa,0,0
7 dokter muka halo monika kabar ganti presiden kali nih ketemu,0,0
konsep sekulerdemokrasi butuh negara sekuler jalan sepakat konsep sosialismekomunis butuh negara komunis implementasi wajar aqidah amp syariat islam butuh khilafah tegak amp laksana cakap,0,0
saudara aji moga allah izin gus ipul mbak puti gubernur wakil gubernur jawa timur,0,0
kayak papakunnapa panggil manggil nete,0,1
panitia kerja panja pilih kepala daerah komisi ih dewan wakil rakyat ri laku kunjung kerja kota malang selasa kemari panja pilih kepala daerah proses pilih kepala daerah kota malang source,0,0
nih kualitas kader buta sejarah goblok tolol salah perintah sumbang hadap bangsa mikir sapi ladang tumpang makan doang,1,1
orang jaman tau pisang obat pusing monyet pusing,0,0
tim aniessandi perlahan bau harum cium orangorang kerja tim 1 1 ciduk,1,0
bunga bangkai,0,0
alay banget tai tentara ngewe banget sih tentara ina gue malu,1,1
bacot kampang,1,1
jilat pantat asing,1,1
inkonsistensi lucu,0,0
anjing fannynnbabi sakit perut gelak uniform resource locator,1,1
gue bilang anjir bagus,0,1
wkwk geblek banget,1,1
ulama abal abal puas misi capai lengser jokowi sih wowokasus ahok doang,1,0
onta paham onlenonlenan,1,1
uang tabung anjir tabung daun,0,1
indeks harga saham gabung buka kuat level 6303,0,0
eh kunyuk embat dana umrah diam,1,1
bacot banget,1,1
suka pamer orang peduli pamer puji kampung,0,0
kain iriana kumpul istri menterigubernur istana bogor,0,0
foto doang anak idiot kayak,1,1
gilasih kimia organik kemarin gue modal gambar struktur doang benzena angkat tangan gue bangkai puter muternnya setan,1,1
jokowi otoriter diktator represif pei orde gue rindu suhao gue duit tinggal kerja kerja kerja,1,0
negara dunia cengkeram komunis asia tenggara negara jatuh tangan komunis,0,0
pakai chara tuyul ngecamp greget pakai mod kena banned wkwk,0,0
bani oplos bikin demo nih by the way kitab umat islam lo,1,1
sampa kolong tol orde aix gubernur geb anis kerja bro presiden ganti soehao sekolah dasar kerja kerja enak bacot,1,1
partai demokrasi indonesia juang beber ongkos rogoh partai demokrasi indonesia juang mencaer pesawat jokowi itudasar korupsi uniform resource locator,1,0
orang paham bicara gue fangirl antekanteknya,0,0
lowong calon pegawai negeri sipil derajat diskriminasi perintah jokowi,1,0
ahoker takut mati salat tenang abu janda ustaz gadungan salat ahoker jokower,1,1
xl culun buh undang undang,1,1
cepat cepat anak kakak lucu pei sipit hehe,0,0
anak cucu anut agama yahudi nasrani,0,0
suruh pakai mata uang cina suruh pakai plodukploduk tiru cina suruh ajar bahasa cina suruh bantu cina pribumi negara tumpah darah pribumi woiiii mimpi,1,0
kalah kuasa media cukong sembako pilih kepala daerah jakaa menang daerah tinggal sih raja hutang partai politik korup komisi berantas korupsi cukong koruptor bantu likuiditas bank indonesia rupiah 600 triliun bandar narkoba tenaga kerja asing cabut subsidi rakyat banc,1,1
ngewe mamak lahir hasil inses mamak ih banci sih ngewe laku anak haram kayak seram hater perintah ter,1,1
gila mentang mentang anak,0,1
levai kompas media indonesia kompas aiman show lebai wawancara tetangga teroris sekolah rumah nnini kompas media kristen gereja hobi,0,0
pintar pintar nih rezim nnnyerah kerja nnanak tk pintar main mobile legend bohong congor,1,1
kepung kantor jakaa,1,0
lhapembunuhan munir era kakak bin pilih presiden 2014 tim sukses jokowi,1,0
cebong ngei,1,1
mati bom kelas,0,0
transaksi non tunai indonesia rekam asing behaviour masyarakat baca nixon,0,0
beda adid aidit aih dasar jongos jokowi,1,1
bayang potong adegan kesal isi lapor kacau kayak editnnperlu gue katakatain gue bajak gebetannya biar sih kunyuk uniform resource locator,1,1
ikat keluarga mahasiswa ajar indonesia unsur noda agama puisi ganjar,0,0
ahok pimpin nista agama penjara,1,1
masak wakil rakyat contoh rakyat bayar tagih listrik listrik bayar salah jokowi tingkat ekonomi lesu amp fadli zon bayar listrik,1,0
setya novanto sangka hakim takut siram air keras mati dadak pei amerika uniform resource locator,1,0
cewecewe nihkalo capecape dandan berjamjam cowok bilangnnaku suka polos,0,0
hati hati kali usir ahmadiyah kristen susul buddha hindu sunni usir,1,0
suka ngentot mentok uniform resource locator,0,1
pasang calon gubernur wakil gubernur pilih debat buka pilih gubernur jawa 2018 malam,0,0
alex untung tuduh antek cina partai komunis indonesia haha,1,0
perintah bastian lengser jokowi menghalanghalangi aksi bela islam,1,0
bodoh bego,1,1
enak ngentot sayang,0,1
cisol modar,1,1
jam anjir wkwk,0,1
kontol manis,0,1
lae makan bawang putih hasil impor asing by,0,0
duduk dewan wakil rakyat mantan menteri komunikasi informasi posting hoaks hadehhh doa jokowi endut gagal paham,1,0
ide brilian motivasi pegawai negeri sipil semangat kerja kerja samping jam dinas,0,0
tidur 10 menit dorong wajar cover lagu sinting,0,1
bilang teman beli tiket mending belikan nih bensin gue dongok nih motor isi pakai air,1,1
saban ios hebat nntiada beli iphone harga yahudi kecewa,0,0
cebong tolol klimaks berita hoaks,1,1
gue tksmp swasta katolik pas negeri kenal anut agama katolik wali kelas gue bilangoh nonmuslim gue balasiya bu katolik balas nonmuslimnnentahlah,0,0
horeeee salah cebong paman kabar om,1,1
baris anti antek asing koar koar nyata aksi bicara kuat,0,0
muka kayak pantat monyet beruk celeng,1,1
link nih asli indonesia tonton ngaceng unduh full video,0,1
bacot sih cebong bangsat,1,1
rupiah prediksi hambat kuat sentimen pos,0,0
banting gadget eeee shopeenya kacrutn,1,1
pilih aplikasi bentuk doa lintas doa allah hidayah sakit sadar salah rela doa lisan,0,0
negara jerat utang bijak boros perintah anggar rupiah 300 gaji dosen asing,1,0
bani kampret nafsu kuasa korupsi jemaah pei kader partai adil sejahtera gubernur sumatra utara,1,1
bangunmakaneekmakantidur tonton,0,0
mantan menteri ekonomi maritim nilai presiden ganti jokowi selamat bangsa lengkap,0,0
inti partai adil sejahtera mesti salahnwalau salahnitu otak cebongnmakanya,1,1
anjing komunis gonggong sahut,1,1
by the way adik gue putih banget orang sipit astagfirullah untung pesek,0,0
memek basah nih bang abang masuk tahan ah ah ah,0,1
eh bangsat nih jaring keparat kerja sih kerja bangsat mahal doang fasilitas kayak anjing babi,1,1
helikopter isi warga negara cina jatuh morowali sulawesi 2019 euy sabar,1,0
muslim tonton bola kafir haha munafik lohnjokowi gue full tonton bola timnas persijanberak mencret tong,1,1
bego pakai tag gue,1,1
buaya,0,0
presiden cebong jokowi,1,1
gue taplak meja warung tagih,0,0
horor senyum seringai orang asing,0,0
etnosentrisme sikap anggap budaya milik anggap rendah budaya,0,0
iman tipu hukum halal demo kaum bani micin,1,0
kosong masjid jemaah khas ala komunis,0,0
tanu usir cina,1,0
nih platipus idiot kasih udara,1,1
