cowok usaha lacak perhati gue lantas remeh perhati gue kasih khusus basic cowok bego,1,1
telat tau edan sarap gue gaul cigax jifla cal licew,0,1
41 kadang pikir percaya tuhan jatuh berkalikali kadang tuhan tinggal orang tua rencana pisah kakak pilih kristen anak ter,0,0
akunnku tau mata sipit lihat,0,0
kaum cebong kafir lihat dongok dungu haha,1,1
bani taplak kawan kawan,1,1
deklarasi pilih kepala daerah 2018 aman anti hoaks warga dukuh sari jabon,0,0
gue selesai rewatch aldnoah zero kampret 2 karakter utama cowok kena friendzone bro xd uniform resource locator,0,1
admin belanja po nak makan ais kepal milo ais kepal horlicks cendol toping kau kau doket gerai rozak meuaku taipan 2 kembar baby amp romantika bank islam senawang,0,0
enak ngewe,0,1
gue jari gue ukur nyali bacot,1,1
banci kaleng malu peanyaan 2 nyungsep koe uniform resource locator,1,1
ajar ekonomi mesti jago privatisasi hati orang aduh ironi,0,0
aktor huru hara 98 prabowo si lengser perintah jokowi nyata,1,0
bu guru enak jablay guru sekolah dasar sihnkayaknya nikmat pecun guru,1,1
lawan bicara gue intelek kayak otak kencing onta gue hadis nabi sahih kafir kayak tolak ahlun nar,1,1
pikir ampas banget,0,0
ari bek rapi monyet,0,1
cowok gantle gantle nama banci,1,1
alga mnr bom,0,0
anjing gue jarang ambek takut wkwk gue budak cinta,0,1
noob peluang sakit gede sih,0,0
joko widodo nilai presiden lemah sejarah indonesia jokowi milik modal dukung politik ketidakmampuan perintah hadap situasi ekonomi,0,0
ajar camat bilah hilir deklarasi anti hoaks amp pilih kepala daerah 2018 damai,0,0
bandara udara internasional keajati bangun gubernur ahmad heryawan anggar belanja negara perintah pusat insya allah operasi,0,0
gubernur presiden rakyat kitaa2,0,0
sih kerja delay mulu setan,1,1
pintu sorga pintu sorga asli pintu hati modus banget,0,0
partai komunis indonesia muncul jelang pilih kepala daerah pilih presiden goreng gosong,1,0
neneknenek heran cebong bohong,1,1
islam nusantara produk jil pasar gencar antek jilnnsementara jil anti arab pro asing nnkata almarhum kh hasyim muzadi,1,0
habis sahur jam 10 si bayi nete kali lemas,0,0
kak emak suka sipit wkwk,0,0
laku homo jaman now ngentot live blued uniform resource locator,0,1
kak gue orang jawa maaf gue orang palembang kakak deh ajar aksara jawa kelak ajar budaya palembang,0,0
pegawai guardian training kayak mentang mentang gue kayak gembel kaos flat shoes dijutekin bangsat malas beli kabur gue matahari,1,1
bajing luka lady terima ganjar ratus kali lipat sanji,0,1
aja tolak berita hoaks sukses pilih kepala daerah wilayah kota,0,0
presiden ri jokowi kerja tulus ikhlas,0,0
edan tuju fabiano,0,1
alquran bang mulut kayak orang kafir bejat hina farhat abbas law,1,1
lihat beda wibawa wibawa gubernur indonesia masya allah,0,0
anjir kali lihat orang bego debat pilih kepala daerah kerja serang karakter kecewa on empok silvy and agus,1,1
keanekaragaman budaya suku agama sungguh kaya djarot hadap pesea rakercabsua,0,0
islam lokalisasi kristen mas nusantara mas lihat gereja bandung pakai gamelan khotbah pakai bahas sundajawa huria kristen batak protestan nusantara,0,0
cipta situasi aman tertib masyarakat jelang pilih kepala daerah 2018 kepala polisi sektor konang silaturahmi tokoh masyarakat,0,0
positif koknsepositif respon masyarakat terhadapn cangkul imporn garam imporn beras imporn jagung imporn tenaga kerja imporn esemka impornnurl,0,0
sembahyang adopsi tradisi lokal kerja hindunnistilah lahir tradisi ritus tunggal sembah all,0,0
didik bodohgk larang bawa agamabiar orang islam bayar ahok sadar pilih ahok gila,1,1
ahok the best abai kaum kampret otak micin,1,1
sih otak tempurung laden lawan dungu makan hehe,1,1
awaasss berita saudara gerung susah cari kosakata bocor picing mata bibir monyong samping suara ky nhn kentut politik kotor zaman b pulang ky nhn ngedendungu,1,1
pinokio umur 3,1,0
cerita silat lae kho merah muda indonesia liang ie shen tulis cina,0,0
benci umat islam,1,0
provokasi mayat politisasi agama kalah pilih kepala daerah daerah khusus ibukota cebong deskripsi kalah junjung for your information ahok pilih camat wakil etnis mayoritas,1,1
gue nete,0,1
wkwk bani lowo,1,1
takabur lahir kuasa rakyat ulama cendikia iblis makhluk alim amp ibadah atus ratus laknat hasud takabur orang ahli ilmu filsafat failosof demo sendi,0,0
a orang suka konserkonser boros,0,0
ulama hukum rokok mubah,0,0
susilo bambang yudhoyono presiden ri 6 khofifah emil masyarakat no 1 bagus,0,0
kali gue gemar korea pop omong teman teman gue idol gue banci homo,1,1
suka video uniform resource locator kisah seteru haji bolot amp malih tongtong,0,0
budaya kafir sungguh islam indah,0,0
lahm hem diam bisunkita coba rumput goyang,0,0
setan bisik waswas lindung allah qs ala 200 fussilat 36,0,0
atheisngapain sibuk agama orang,0,0
lengser jokowi bangsat,1,1
selamat kain,0,0
bajing homo hati hati hadap anak anak utama kamar mandi laki laki biar uniform resource locator,1,1
cocot,1,1
budaya indonesia,0,0
ajar solata orang asing pecah belah islam,0,0
x bicara bangkai,1,1
percaya negara jajah ranah bubar sistem sistem beraja negara negara republik komunis negara negara jaja,0,0
nikmat bijak usul partai komunis indonesia,1,0
umpama orang cina usir paksa indonesia,1,0
bunda ngentot yuk,0,1
cina babi cina malingn,1,1
karno anti asing beliau jawa coba deh adakan konsensus jawa anti asing pro asing keboohannya nnkalau keliru tutup akun,0,0
proyek korupsi rezim susilo bambang yudhoyono uniform resource locator,1,0
wajar lihat tingkah petinggi negeri suka campur bahas indonesia bahas asing kali bicara,0,0
ab pribadi senang kompetisi positif,0,0
kitab suci agama bilang om,1,0
suka tutup mata tutup lihat teutup gara gara sipit,0,0
muslim nista kitab suci alquran alquran suku detik makna faktual umat islam makna sirat fiksi,0,0
eh kasar kampang,1,1
bentar gue rilis album the ontas wkwk,0,0
cebong bang,1,1
najis banget gue mentwit barusan he,0,1
transgender anjing uniform resource locator,1,1
awas bintit intip titit kucing,0,1
bawel bawa asa bolot bodor wkwk deh,0,1
gue saran bacot maling ayat langsung to the point orang paham riak kafir sesat liberal puja dukun bla blaaa hati puas deh,1,1
salah target ahok agenda utama lengser jokowi,1,0
kena tagar panas banget,1,0
maju duit goyang kaki pape duit nak maju kat bodoh uniform resource locator,0,1
huria kristen batak protestan pecah kristen katolik zaman jajah belandadl nama kristen protestan kristen khatoliknterjadilah pecah huria kristen batak protestan pama kali tarutungnnnah k,0,0
baca biar pintar jepang amerika cina utang tau,0,0
prabowo kalah bantu jokowi citra ratap pilu,1,0
takut azan iblis,0,0
goblok bani cebong tukang tipu jilat kuasa gera bayar pakai nasi bungkus propaganda nasi bungkus gagal,1,1
cebong sewotn,1,1
2 gera tekan kerja keras total tingkat potensi bangsa,0,0
gubernur djarot mayoritas paai politik dewan wakil rakyat daerah dukung ahok djarot payah uniform resource locator,1,0
rezim rusak sistem sibuk cari cari salah ketemu komisi berantas korupsi alat besok perintah ganti ulang engah selesai organisasi orang,0,0
orang orang tuding antek asing asing sungguh beepuk tangan,0,0
anti asing,0,0
selamat moga kiprah tingkat nasional,0,0
sih ulama,0,0
ketapang tenaga kerja asing asing kerja usaha masuk pt who tambang bauksit viral pilih presiden kerja era gubernur cornelis wakil,0,0
anak pecun hobi zina haha,1,1
bom surat harga syariah negara,0,0
istirahat presiden momentum saksi telinga mata rapat bentuk pacitan 2003,0,0
1979 house select committee on assassination hsca temu cacat investigasi laku fbi warren commission hsca simpul tembak laku konspirasi,0,0
asa genap 1 17 april 2018 gelar hajat pilih presiden acara negara indonesia pilih presiden moga senantiasa jalan aman lancar amin,0,0
ian pantat,0,1
orang pintar agama agama nista hujat orang orang bodoh orang maaf lahir idiot harga cipta tuhan iblis pintar licik,0,1
daftar calon presiden buka agustus 2018yang normatif politikus partai demokrasi indonesia juang paham,1,0
sih tolol tau perintah rezim komunis bobrok koruptor pimpin sidang dewan wakil rakyat paya cebong uniform resource locator,1,1
gue mantan mantan gue sedih pikir tidur lo gue anak berengsek laki laki,0,1
cina usak bangsa usir tuju,1,0
konstitusional hak rakyat woiii nih plonga plongo laku otoriter,1,1
wujud pilih kepala daerah kota bengkulu 2018 aman damai cok adem86 98herua,0,0
serius presiden jokowi islam nusantaraknp kristen nusantarabudhahindu kong hucu nusantara,0,0
nyata moeldoko bukti istana takut bangkit umat islam,0,0
cowok jago drasex ngentot adik luvian,0,1
kroasia kafir tauuungapain ajar kapirudh lupa kapling sorga,1,1
menteri suhao homo,1,1
gue tau culun takut orang ubah perlahan lahan buruk,0,0
perang salib raja afrika babilonia peluk kristen tobaco peluk islam,0,0
kejar setor bangsat rupiah turun,1,1
moga tindak lapor hadap nista agama adek armando laku langsung ketua front bela islam kh shobri lubis badan reserse kriminal markas polisi republik indonesia gambir jakaa pusat selasa 104 1300 indonesia barat,1,0
bangkai hajar,1,1
onta mati minum,1,0
uniform resource locator ahok tng waswas hidup,1,0
sul teng ekses akibat sandera hutang cina,1,0
6 pride yunani hyper keangkuhanharga dirikesombonganndikenal hubrisvanity harga ubah manusia sombong sombong manusia kutuk mata tuhandan manusia cinta,0,0
bea tuju hatinlogikaku hati tenangnaku bea logika hati sedih ku cari wasiat beliau tinggal asing asing mata manusia duhai,0,0
beaji komisi berantas korupsi era initapi era komitmen berantas korupsi surat pemberitahuan era susilo bambang yudhoyono,1,0
admin tolol paai tololnpaai tolol orang tolol,1,1
ayu ting ting goyang hot raffi ahmad nagita slavina kampung norak uniform resource locator,0,1
video tenaga kerja asing malaysia kutip nyata,0,0
ppp buruburu tolak wacana pilih kepala daerah lewata dewan wakil rakyat daerah,0,0
random pagi pagi samper meja kerja pakai bedak sih biar muka bersih istri butek soalnyaningin ku pakai air wudhu ku kristen,0,0
gue kampret,0,1
memek lonte sodok kontol gede,0,1
jokowi mundur tutup uniform resource locator,1,0
bicara itumulut pei bancibeli kaca lihat bro,1,1
amin rasisnada daninada ratna sih paiiitnada sih ontanada sih lobang anusnjdi takut oi wonkehabisan obat tenang,1,1
tunggu komando imam bejat cabul tai bir nnape2 bawa ulamandasar banj sempak,1,1
kabinet beranta pecah belah rezim,1,0
ih pintar orang politik kaca oi tampang k orang bego wkwk,1,1
tekan usaha tambang target proyek impossible lelang murah antek cina ntb contoh partai demokrasi indonesia juang menang dasar bajing,1,1
percaya mulut buaya mu bawang,1,1
2019 susilo bambang yudhoyono prabowo lawan mega jokowi peristiwa 2004 ulang partai demokrasi indonesia juang incumbent kalah mutlak susilo bambang yudhoyono jkwmegasby lawan prabowo mk pilih presiden selesai 3 poros pilih presiden mk salah lawan,0,0
kayak banci kaleng gatot gaduh gentleman mundur saing pilih presiden 2019 lawan jokowi,1,1
bebal,0,0
5 indonesia negara populasi muslim dunia islam rupa musuh barat amp komunis hambat agenda obviously,0,0
umuh persibnpersib kunyuk,1,1
film muslim pilih ahok mati salat jamin laris,1,0
banu banu yahudi beda banu banu kristen suriah salah beda banu yahudi pakai eloah elohim yahwe suriah pakai alah allah,0,0
eh muka merah merah cendol setan cuaca nih panas,0,1
berita saracen diframing katak tim prabowo aniessandi media tumpah sakit hati katak cebong ehe,1,1
giat bhayangkara bina aman tertib masyarakat brigadir polisi manajemen bas sekolah sihombing rabu 11 april 2018 laksana sambang desa tatap muka pantau aman tertib masyarakat tuju pilih kepala daerah 2018 desa lobusiregar i rumah rudi panjaitan helm siahaan hotman siahaan,0,0
sayang banget lihat perempuan kayak status tempel lakilaki haduhnnagita slavina blakblakan ayu ting ting kampung viva uniform resource locator,0,1
lupa kang umat katolik minoritas perhati gubernur golong golong,0,0
cebong bilang kemarin ngeyelnsitu paksa cebong,1,1
lemah gerindra orang iniprabowo turun elektabilitasnya congor fadli zon surat pemberitahuan durno,1,1
selamat kain kali raya makna kali,0,0
foto bisu milik ai susah diaikansma pei susah diaikanmau putus,0,0
wkwk alam muncul grub wa an bani abdi had aka mbah mek kenal orang,0,0
ayah pres badar nuqaba boekkkd nih hebat bidang agama x takut natural killer tegur member lawak hambar lawak orang jom gerak gera badan chubby,0,0
a orang anak pekan ilham dasar ekonomi deb gerak utama maju ekonomi bandar beliau allah rahman tun abdul razaka ds,0,0
haha sialaaan nih sih nyata lapar presiden sikat doid 12,0,0
nasihat kali ugal ugalan nih rezim eh negeri keburu ancornah ekonomi moral meni kacaoooooo,1,0
alah silit kebelet kasihan orang sayang paknsetelah media sosial gue sadar instansi kemarinntar gue cerita duuuhhh,0,1
cacat,0,0
2019 rakyat makan aspal beton solusi jitu miskin ahli cebong 1 tukang tipu cebong goblok ketulungan plonga plongo akibat optimisme,1,1
baca harun yahya belot kubu yahudi freemason nyakdg suka percaya,0,0
maju ulama gerak tokoh agama indonesia,0,0
,0,0
peanyaan mudah keras keras nama,0,0
kemarin hujat harap dasar bani kampret,1,1
fitnah sila ban apollinaris darmawan alquran kitab sampah,1,1
monyet koloe bilang saudara ogah hidup hati comberan,1,1
body lufra scrub bahan dasar lidah buaya melembabkan kulit amp cahaya info 087812026394,0,0
cacat,0,0
anut bumi datar teori bumi bulat orang asing notabene musuh,0,0
becak warga binjai sita tenda beuliskan partai adil sejahtera radang bukti perintah panik takut,1,0
jokowi mundur,1,0
musyawarah nasional alim ulama ppp semarang hasil rekomendasi syarat kriteriakriteria calon wakil presiden damping jokowi 2019,0,0
cerah gagal anak ekonomi wkwk,0,0
kafan budaya yahudi umat islam klaim,0,0
rezim kendali negara cina komunis patron tunggal rezim anti islam jokowi,1,0
tanda pilih kepala daerah pilih presiden,0,0
misi 4 bangun masyarakat gotong royong toleran harmoni selaras nilai budaya jawa barat luhur,0,0
tabah pasang taufik puan nurliyana wajar contoh jom sumbang ringan beban pasang come on twitter do your pikir badan standar nasional 0510541000096745 bank islam 05058020145124 nurliyana bosan abdul razif,0,0
sih tai doang belaganya langit karma idol flop gue tertawa keras,1,1
celeng kangen gue,0,1
budaya yuk unjung purwokeo mumpung even rakyat,0,0
presiden dana taktis rakyat program program perintah program bangun infrastruktur kip kartu indonesia sehat seifikat tanah hutan sosial bahan bakar minyak 1 harga padat karya,0,0
amin allah tim latih ular rawarawa sungai gede musuh buaya wkwk,0,0
maju maki mama bolot,1,1
gerombol kadal jidat gosongmmg suka ribut gerombol salah pura pura budekdasar gerombol cingkrang uniform resource locator,1,1
gentar takut hadap kafir,0,0
saracen akun kritis anggap saracen aneh jokowi,1,0
bego teman gue najis kesal gue,1,1
kafir kristen ulah,1,1
tau bau bau cir sipit buluk,1,1
kayak pegang mucikari,0,0
guru tk darma wanita desa plumbon porong deklarasi anti hoaks benci isu sarah dukung pilih kepala daerah damai,0,0
anjir seram main,0,1
kayak bank teentu bilang jual uang asingtukar rupiah,0,0
onta yaman ninnsetahun gue depoasi,1,1
hatihati berita pilih kepala daerah bau hoaks kunjung,0,0
anak cocot,1,1
hoaks fahri ambil berita tuyg tong sampah ambil screenshoot tau berita,1,0
mantap direct message baris serba bang,0,0
nyata lebah suka bunga makan bangkai gue penasaran madu kayak,0,0
indonesia mundur bentuk,1,0
dongok bilang hacker haha,0,1
haha blunder cebong protein energy malnutrition pusat alas ham rakyat aceh kali coba perintah bilang suruh hukum islam kaffah aceh dewan wakil rakyat a,1,1
bangsat gue selam 1,0,1
dipancingpancing urus nista bicara paham fiksi kitab suci,0,0
cebong kacung teman gue dungu tulang sum2jd buang buang energi debat,1,1
paai korupsi sapigoblog,1,1
sinyal kontol pelihara niat sih login twitter doang susah open redtube setan,1,1
mata kafir wkwk,0,0
facebook anjir lupa,0,1
sih bilang alah kontol,0,1
nikita mirzani pakai hijab bicara cebang cebong fantasi uh ah,1,1
tatap alih arah enggan tatap pria curiga peama kali gaduh suasana angie temu orang pria asing tidur sofa pei,0,0
lahir kembang gera komunis indonesia pisah buah organisasi nama indische sociaal democratische vereeniging,0,0
shaheizy wajah baharu calpis,0,0
serah balas fokus kerja kerja tugas proyek seni budaya 2 langsung kumpul presentasi syukur nilai muas proyek,0,0
bro,0,0
laku bodoh masuk kategori menyenangkannnkelakuan sontoloyo menganggu bangsannkelakuan naif langsung bentuk intimidasi hadap ulamannkelakuan,1,1
monyet turun mukim warga cibadak sukabumi uniform resource locator,0,0
kotor bahagia warga cebong ngei,1,1
giveaway taplak meja menang the rich chenle,0,0
buka busuk kubu anies sandi menang berkah uniform resource locator prabowo usaha cuci tangan,1,0
wkwk bodoh bang,0,1
kayak orang begobro tapimemangbego,1,1
menteri lingkung hidup hutan upaya perata ekonomi tora kawasan hutan hutan sosial tribun medan,0,0
mahfud md allah subhanahu wa taala berang bangsa ajak buang islam,1,1
orang orang bego minum amp makan kotor onta otak somplak,1,1
kuak strategi kampanye tim menang anies sandi uniform resource locator,1,0
warga badui selesai tradisi seba pendopo perintah kabupaten lebak beemu gubernur banten wahidin halim sabtu 214,0,0
lembaga lembaga anti korupsi bubar sentuh kuasa gilir komisi berantas korupsi partai demokrasi indonesia juang paai politik kuasa pulang otot bubar komisi berantas korupsi,1,0
mas sudut salah agama bahayaitulah rocky cerdik susun kalimat amppantas dgunakaninti kasih tau pngeian fiksi sbenarnyaayolah mas i,0,0
dukung calon presiden gagal pindah on sibuk urus asing bawa kabur uang rupiah 35 t sadar asing kabur bawa uang dukung pribumi anjing mustahil asing pribumi diam sogok mental kacung uniform resource locator,1,1
rabun budek gue tulis bicara,1,1
bismillah tahan sepo kutuk,0,1
brahahahaaa cebong ahoker cebong cebok,1,1
update status bikin tugas tugas selesai jancuk jembut,0,1
muslim jabat negara beindak bangsa negara,0,0
12 ikan sembuh sakit selamat bagus laik jual pisah seleksi ikan cacat permanen pelihara nnncc,0,0
ainya pribumi sadar lihat samasama cina komunis misionaris abai twit usir cina indonesia,1,0
presiden tuduh rezim anti islam negeri umat uniform resource locator,1,0
manusia bangsat,1,1
cina kenal wisata haram indonesia haha,1,0
prabowo partai adil sejahtera bib asyik anggap antek prabowo antek partai adil sejahtera hidup dramatis,1,0
sahabat salahlovren bukti beda suku agama ras halang bina hubung umat manusia beda warna jalin peemanan terima kasih lovrensalah a i,0,0
laemeskipun turun turun ideologi partai komunis indonesia lekat jiwa,0,0
kesal rokok motor kadang pengap tutup macet,0,0
maaf kunyuk bronnenak banget rasan merekasebar hoaks maafsebar hoaks maaf laginnmesti sapu biar jera nih orang uniform resource locator,1,1
halo warga jakaa wakil kepala dinas tanam modal layan padu pintu provinsi daerah khusus ibukota jakaa denny wahyu haryanto wakil wakil gubernur provinsi daerah khusus ibukota jakaa buka acara 2018 junior chamber international jci indonesia nasional event,0,0
2 kuat jaring gubernur tekan kuasa state of the a knowledge sea bahasa rantau indonesia,0,0
pandang tuan guru bajang hadap agama politik,0,0
sedia berengsek,1,1
susilo bambang yudhoyono presiden ri 6 khofifah emil masyarakat no 1,0,0
dungu orang ganti presiden tau mikiiiir,1,1
bokep cewek bispak bandung ngentot crot nndownload full uniform resource locator uniform resource locator,0,1
kampret complain raga tanggap fuck,1,1
kayak jablay grand theft auto jemput pakai mobil,1,1
lihat memek tante,0,1
kerja musuh dakwah islam bubar hati rakyat hak lengser jokowi kodok tukang citra,1,0
ha lengkap orang bukti goblok sih,1,1
salah orang khalifah rasyidin rang orang kafir orangorang munafik orang munafik,0,0
suka nete uji nasional maklum,0,1
nek lihat match chelsea sih menang mudah manchester united embuh sih chelsea kacrut ki prediksi,1,1
kali tentara nasional indonesia suruh urus sampah plastik,0,0
khawatir manuver politik bijak laku rezim moga negara republik indonesia cinta amin,0,0
madi arya lapor rocky gerung polisi serius kitab suci fiksi rocky nyata salah hina tunggu anut agama a anggap kitab suci,0,0
bajing tengik,0,1
pakai buruh cina rakyat pnganggurandasar rejim kodok,1,1
,1,1
rupiah haneul cute pacar perekyang on retweet,0,1
bilang anti asing asengnda tau wkwk,0,0
suriah sekolah radikal rakit bomplg indonesia pklya aman,0,0
kadang hidup kayak tai kadang berak orang beres tainya tangan,0,1
ih banci selotipan,1,1
haha kalah nih orang jahat kalah,1,0
keanekaragaman budaya suku agama sungguh kaya djarot hadap pesea rakercabsua,0,0
cinta orde meng idola prabowo amp hary tanoe,1,0
tantang buka dada eh setan habis kamus lawan kenegarawanan joko widodo presiden ri 7 stresssssss nih hati hati kena strok serang jantung rakyat indonesia hilang badut badut politik merdeka,1,1
belah duren yaaaangak dunguya cebongnmaaf,1,1
2orangorang yahudi nasrani al kitab taurat injil kenal muhammad,0,0
bubar hati amp front bela islam uniform resource locator,1,0
ahok verbal keras lampias lari lelaki lunak,1,0
teman teman kantor langgan cadar langsung bilang awas bom hela nafas,0,0
pantat nih tusuk ditusukn bo wa 08157686707n,0,1
ancam bunuh presiden republik indonesia mas mesti lapor tegak hukum beindak ancam bunuh kepala negara,0,0
kayak orang nyosor nete,0,1
ngewe,0,1
jebur cebur,0,1
partai adil sejahtera ulang balai kota rr bicara calon presiden balai kota ganti nama a balai politika a,0,0
rencana seret adil ham pbb uniform resource locator,1,0
bijak barang konsumen laku barang rusak cacat produksi konsumen puas produk hitung 7 tanggal pembeliann kunyuk ikutann,0,0
kisah hidup muhammad lengkap unduh,0,0
jajah bumi indonesia hapus jajah ekonomi budaya hasil bumi cina basmi negara republik indonesia usir,1,0
we pipis onta cecer bau pesing,0,1
teriak lantang pmh pro asing pas tawar bantu asing bikin posko inti kompor keluarga korban pmh bilang 15 3,0,0
berjuangsampai lantik 2019njangan gentar takut mata benang leher ujung tombak perut nntidak surut langkah kitantidak bisu suara kitantidak,0,0
kayak monyet,0,1
survei metro televisi jokowi menang presiden hitung 45 kalah 46 salah judul maksud jokowi menang sumber zie bajrie,1,0
,0,0
cuba tegak anime nih karakai jozu no takagisan nak feeling feeling cinta monyet zaman sekolahmemang throwback habes910 uniform resource locator,0,0
seru pesta budaya derau kuta kaanegara,0,0
kontak retweet yanbanyak banget kenal tante jilboobs sangenini nama tante dea o,0,1
debat publik ajang bukti pintar ruang akademik pamer indah orang kuat lemah egosentris nama kuat tahan l,0,0
duduk istana negara lengser jokowi salam,1,0
hebat sibuk citra baca nih,1,0
muslim hina iblis betina nista syariat,1,1
baby kafir buddha teroris myanmar,1,1
indonesia merdeka indonesia jajah orang cina takbir allahu akbar uniform resource locator,1,0
politik hanta yudha pasang calon no2 jawa,0,0
jongos nista agama ahok sok sok ngong saramajikan tebar sara astagfirullah tobat,1,1
follow beli katolik akun prof wawas berbangsaterima kasih,0,0
sih bejat cabul kecut sih onta,1,1
wibisono citra jokowi sebar up media massa pro asing kes jokowi hasil,1,0
adi gaya kayak beruk supir tembak metromini masuk dprnkampungan,1,1
km mainstream mengaaikan pintar pintar relatif gantung bawa pengeiannya surat pemberitahuan pintar mengundeeestimatekan orang gue pintar komen rejim now pintar mangkrakan janji janji doang somaking,1,0
gue dongok,0,1
ih masak sampah,0,0
gue pukau,1,0
aspirasi lina sumedang calon gubernur jabar berantas rebut laki orang resah hidup warga desa,0,0
yaelah chat urus lihat mesum anggota dewan wakil rakyat diam nyata selingkuh tujuh pura pura budek otak,1,1
takut cina pai dap bimbang paham bawa,0,0
cermin pecah kaca,0,0
langsung tag paainyanga berani berai banci,1,1
aw asing warna,0,0
islam manusia idealis realistis hidup lupa ajak kerja keras ajak istirahat,0,0
kristus anjing anjing jembut keparat picek tai pejuh siwuk kutang siwuk idiot keparat picek tai pejuh siwuk kutang siwuk idiot keparat picek tai pejuh siwuk kutang siwuk idiot keparat picek tai pejuh siwuk kutang siwuk idiot keparat picek tai pejuh siwuk k,1,1
agama katolik katolik nusantara agama kristen protestan kristen protestan nusantara agama hindu hindu nusantara agama buddha buddha nusantara,0,0
3 bas teknologi digital presiden sistem betulbetul jalan langsung ramah,0,0
ah asa hibur cebong bahagia presiden cebong tol cebong germo,1,1
resah presiden hidup penuh drama citra main film televisi joko judul uniform resource locator,1,0
agama kristenngolongan darah bnasal san fernando valley,0,0
buddha bunuh muslim myanmar,1,0
yahudi bangkai jerman ibadah,1,1
papa ketua fraksi rakyat setya novanto dewan wakil rakyat pecat ketua dewan wakil rakyat pecat dewan wakil rakyat,1,0
cina,0,0
hoaks kodok biawak roket sekop bangsat karbitan munafik,1,1
ribut komunis bla bla emoh baca baca niat agitasi serang perintah pakai cari simpatisan,1,0
10presiden jokowi harap skema kerja laku pembangunanpembangunan a a,0,0
pilih langsung biar pilih presiden dewan wakil rakyat calon presiden biar kayak kucing karung bikin mekanisme oke calon presiden gubernur prestasi maju calon presiden gubernur,0,0
vital inter bek kanan beda era maicon dambrosio cancelo bagusnyanhmmmmberai simpul geblek ausilio,1,1
nama agama munafik,1,1
43 contoh tuding duga korupsi susilo bambang yudhoyono dorong jaksa usut himbau komisi berantas korupsi usut duga korupsi jokowi,1,0
cium bau bau pecun uniform resource locator,0,1
henti konsumen wisata haji rumah tipu produsen wisata jiarah indonesia,1,0
buru nazi simon wiesenthal pegang fotofoto gambar mantan kepala gestapo laki laki rauf buah van kamar gas gerak eksekusi orangorang yahudi,0,0
caci maki nista agama nyata poligami umpet sih ogah,1,0
bubar negara republik indonesia harga mati,1,0
baikbaik sih royson jokowi kacung gue nnitulah alas fundamental rezim pei sengaja masuk debt trap komunis cina nnso wajib,1,1
wkwk mampus pepet uji ah,0,1
